0f909595-9efe-4a2f-991c-695ec849fb3a,Account that care action,"Brown, Peterson and Martinez",1989,3341,19,99,14,15,45,200
eadcc651-2677-4693-9364-2a2e4a92e1fd,Still senior large drive,Russell-Cannon,2007,7627,1,99,9,9,45,185
ff29fab0-94f2-47b2-994b-bdedeb28bace,Against several get,"Thompson, Kim and Daniel",1976,1063,6,99,3,12,125,205
6f6b1dbf-0498-4743-a37a-4b5589ef993e,Cup use modern month,Butler-Torres,2020,5915,9,18,1,6,30,35
9cb0bfa2-5ed4-44eb-8d56-99f3ba7ad924,Together budget my,"Smith, Carlson and Bernard",1977,9905,6,12,4,9,70,195
d862db6d-b522-4b08-8ea9-0ee26ae23309,Under follow price,Wilson Group,1983,662,15,21,4,4,30,60
372f8d0a-f266-47b1-8eef-7a142cc5a784,Us agent operation popular,"Kelly, Pierce and Willis",2012,1394,3,99,4,6,100,190
26c96f05-5a14-443e-92b3-7e5ca3c55e58,War these throughout,Barton Inc,1996,5149,4,99,8,11,140,210
81c94a50-87eb-47b7-ab13-69a3e936ade2,Parent cold action into,"Rodriguez, Curry and Gray",1997,8653,4,19,3,14,145,215
f174889c-d5f4-48dd-ba30-540861e7a19e,So several southern,Burton-Sandoval,1972,13810,5,99,6,11,5,125
a45f84a6-f52e-4b87-bd4f-f7c6bf902cd0,Go to wait single,Schwartz-Benton,1971,13123,17,18,1,4,15,105
d900246c-25ef-4f65-854b-9ff317cb983e,Law laugh challenge firm,Brewer-Hernandez,1991,9875,10,17,11,15,70,105
279b6f5c-4b60-4774-9ba2-157923ee7673,Center standard thank,Davis-Scott,2009,12002,1,6,5,14,45,170
f7ff3692-220b-43a6-83e7-69b9b2fa1add,Go drive occur pass great,Carrillo-Hughes,2015,12628,6,21,3,12,130,225
993b48d5-f46c-4bf0-ab43-0992685525bb,On rock region eye,Clark LLC,1991,12695,0,13,4,14,80,180
9b851edc-0113-4e35-874c-98db9cd691c5,Manager take there hope,Williams-Perkins,1981,6325,16,99,7,14,105,210
237a618b-92db-4b25-a25d-d19b6572c755,All reveal coach find buy,Harper-Garza,1999,6474,11,99,2,2,25,205
027f634a-e11a-42b2-971b-528ce9e7e441,Economic actually page,"Murphy, Schmidt and Beasley",1988,11312,20,21,1,14,150,165
21761a9d-0928-4082-8057-6a13f1150be3,Daughter total total on,"Larson, Smith and Escobar",1990,11650,12,99,11,13,40,45
554f83b2-57a0-4711-b6e6-dbb648cf28e1,Reflect know month according,Hooper and Sons,1983,9477,1,8,7,15,90,135
b5288bd4-171f-4d56-ae53-d579a039223c,Themselves chance response,Ibarra Inc,2020,14505,0,13,8,10,55,80
2e1b2b80-6913-4398-9099-182cba35134e,Cover seek Republican,Tucker and Sons,1972,9103,13,99,8,15,5,175
00bb8f1f-c613-47ad-a5ca-9ecfb706144e,Civil court before meeting,"Henry, Sanchez and Caldwell",2008,4009,13,19,2,10,185,230
9dcd7833-86d7-4bd7-ba81-f85d1bf94a36,This certainly expect,Martinez Group,2007,14590,12,16,6,9,115,130
22805c1f-8510-4e27-8037-7aed0b5f08fb,Should minute early new,Gonzalez-Jones,1994,10239,20,20,7,15,70,235
e8da2e1a-59d8-417f-8e22-81c009a95510,Deep new outside firm,Moon-Smith,1973,8667,19,99,10,11,5,95
b4b803cd-56e6-406b-9c1a-c43de3798289,Rate yeah edge evidence west,Hill-Kramer,1985,12258,1,8,10,13,90,110
265970f1-3798-4dce-a1a2-989113cb4d56,Similar apply story,"Young, Ramirez and Palmer",1998,14191,20,99,4,9,145,180
629e5fbd-687b-41c4-9584-91b3ea7fa6b3,Environment rock recent her,Ramsey Inc,2020,9630,1,14,12,14,160,225
0bb39ae6-8569-4305-97c2-e08331f52e00,Challenge force woman,"Chaney, White and Barron",2012,212,4,17,1,10,210,225
37ec0685-1b68-4b3c-bdf9-3ff3ad928984,After life firm always,"Weber, Galvan and Roberts",1983,2299,3,6,2,15,85,210
4ebf59d5-4bdf-4a90-b520-8bc38fcf52c7,Rate ball town general ever,Stewart-Bridges,2010,6746,6,12,4,8,70,165
99e3c78b-c394-4844-9515-b9d534a1f0b9,Will of likely deal stop,Brown PLC,1985,8607,10,99,1,12,10,220
1e39e1e8-1070-4fec-a35f-5aaed5dc2f9d,Whose fine data mean,Galloway Inc,1974,14702,6,13,1,14,15,190
740455dc-6c38-421b-9556-6de736dae2fc,Modern guess few outside,Turner Group,2013,14636,4,7,5,8,65,160
fb266919-bf7b-46ec-9ae7-940e07993ba0,Your people major from,Jones LLC,1971,10892,14,20,11,13,25,65
536ebc4f-2530-49c9-97ac-1142c46f6bca,Room future ground rest,Robinson PLC,2020,8202,20,99,13,13,150,195
228beacf-10c3-4cab-8c96-56fc7c2b84ca,Far say young career,Bennett-Castaneda,1981,11375,18,20,4,10,30,220
68e8c690-7c96-41b2-9f98-15cf411b5878,Least growth along,Trujillo PLC,1976,1556,1,10,1,9,5,15
6850c12d-71ca-4a86-9fe8-38a2ed169bfc,Remain billion more,Campos and Sons,1973,3928,5,15,2,3,5,235
dbda51f7-4cab-4e72-8262-a7b81b40ce8b,Price happy window carry,Hopkins PLC,2016,4410,14,18,8,10,15,85
1fadd2ff-750e-4738-a20c-46b985ed68ee,Young raise way idea article,"Morris, Black and Perez",2006,1827,0,7,3,5,85,220
6a39c60c-73e7-4842-9ff4-6ddf4bbe5b54,Officer run central,"Martinez, Davis and White",1976,5290,8,11,7,9,175,230
c62be9bc-8d88-47d1-8a55-2bd04d7b1a9c,Cut eat read well,Bernard-Miller,1999,10843,0,9,4,11,125,185
4b3ac234-e65b-4b09-a2ba-88d0ec0c3b43,Why agree baby think,"Shaw, Mendoza and Lee",2002,4007,6,12,6,10,90,200
9a824cb6-559a-4174-ab2a-861e2a4b6671,Heart bit woman there mother,Harris-Vega,1993,1482,9,12,6,13,20,210
2fcaf620-4c95-4fcd-a628-91e7c057038c,Evidence respond fear,"Reed, Brennan and Price",2016,4865,15,99,5,11,105,190
14af20ac-880c-49e6-a8ea-58c6c853b5b3,Role usually young board,Moss-Ochoa,1997,11491,0,4,10,11,10,15
3a1282c6-0ec9-4933-9e51-b767455deadb,Stock where serve however,Evans-Austin,2005,2661,6,9,3,4,210,235
ce17319b-f045-4659-95b7-9f44f5aa4fe6,Voice foot skill,"Mckenzie, Johnson and Barnes",2013,7081,1,19,5,10,50,135
78b25a7f-53fb-45c9-87ac-2443b607ebad,After open end decide,"Moore, Gonzalez and Barnes",1980,13757,1,20,2,9,65,180
9b0989af-096a-4d25-81d5-2b787304c3db,Rather card from half,Clark Ltd,1974,1352,0,99,13,14,105,110
4601c2fe-e185-48de-9d0c-660f9cfbd71b,Make decision budget use,Smith Group,2005,3044,1,18,2,4,90,115
d8be08cb-b218-4061-a004-4ce126f78666,Wind both sign soon each,Sanchez LLC,1988,13027,15,19,3,5,145,155
be1a34f4-ee73-47c0-aea5-728e72b7aef0,Describe PM trip,Hayden-Savage,2019,4469,14,16,7,14,5,65
b6f66ed9-f4a8-4015-9c47-83908a77f5c2,Later feeling group charge,"Rodriguez, Lee and Andrews",2004,14766,3,17,2,7,85,135
cfa9388e-6614-45e2-a2e9-ddb15e5632d3,Food accept part room,Nelson and Sons,1982,14843,8,15,2,7,125,175
7d384331-c194-485a-aa3a-41b412d63afd,Wall miss perform impact,Reeves Inc,2002,4504,9,20,2,15,75,120
0ad476ee-733a-414a-ac11-860502fb165c,Would democratic woman,Jones-Crane,2016,4044,9,99,11,14,5,40
9277fc7f-a571-45d1-9464-9ab8f5bc1c4d,Cut free walk tell,Hodges Group,2018,9060,8,99,11,13,110,175
3577558b-075a-45ea-942f-1328e61901c9,Need who job whom side,Robinson-Ewing,2004,6225,0,8,5,13,120,205
350513e6-8d09-4d5d-bff4-9112b59228f1,Specific politics red simply,Rivers Inc,1980,8181,4,12,5,7,10,65
62519bb1-1776-46a1-92ea-34233cde74d2,Do none them avoid,Williams-Elliott,1973,10356,5,20,4,9,10,30
06a338c2-3c36-43a3-98e4-5432e0d2e97d,Successful hold far standard,Tapia-Malone,1986,8163,20,21,11,14,180,205
4770faf2-c7b6-4e2d-a3a5-13e902bf8e67,Spring it here several foot,Hutchinson PLC,1991,11066,17,99,3,9,185,210
b00f2e00-0fec-4bcd-a16f-73091124edf3,How Mr same anyone really,Hurley-West,1987,13365,16,99,7,8,30,130
ca0edfaf-f03d-4352-b971-16893603f58b,Collection benefit save show,Medina-Riley,2016,4614,12,99,2,13,45,200
86e12f8a-f535-4b91-9d4c-4a3849ea6f2f,Cut fact visit half,Drake-Campbell,1970,7525,1,19,1,12,25,70
a3c7a242-c26e-4eee-8be1-ec6cbc3f4227,Night cell address study,Berry-Rivera,1982,12354,21,99,3,10,85,220
cc0094f2-ac11-4691-ba9d-b165f786fc65,Gas on method unit go bag,Harris-Nelson,1977,9497,10,99,5,7,95,105
ff31b96b-b34f-4500-b617-1f4215d950f2,Matter whether shoulder my,Gordon-Shea,1985,12056,5,16,7,11,105,200
328b851a-3e8b-4e3d-9cc0-8cd7f19f38c1,Eight learn for base,Rodriguez Group,2004,12828,12,19,3,6,30,45
c563a137-29fe-436d-90c9-be0824f8ae54,Begin weight again maybe,Walters-Foster,1974,5772,13,99,5,6,135,155
6d3ba1ce-842b-45e3-bdc6-91aebf70fdb3,Them control us customer,Wong-Miller,2005,12398,12,16,6,12,50,80
21e9b3b0-2938-410c-8496-ba1154e3950a,Energy issue later garden,Baker-Green,2020,3982,2,21,6,9,205,235
b3f3beea-a987-47be-951f-f1517d8d377e,How admit notice success,"Park, Baker and Alvarez",1987,12269,3,14,2,14,30,140
96ed530b-a6fe-4a64-9561-0ccfc6cbd3ed,Become ball star,Lawrence and Sons,2015,14981,5,6,3,14,25,190
a9c3be3d-3039-4d0f-8deb-178665c388d3,Stand country country,"Walters, Weeks and Powell",1977,26,5,16,4,10,60,135
c880bbb9-ffa3-4a9d-979b-b9f0728a3616,Whole note baby health,Johnson-Weiss,1992,2809,14,99,3,5,5,130
4c433c27-cabd-4cf7-a406-70fbeaa45343,Themselves will season money,Peterson Inc,1998,14377,3,8,8,15,10,125
cba57811-ed50-41c7-96a8-e533d338ba2d,Special decide hear,"Andrews, Wallace and Carpenter",1984,7170,3,9,4,9,205,215
d1ead465-5395-4081-8c15-190341863ac4,Specific year message them,Schroeder Inc,1998,10766,13,15,5,9,160,195
7080a11e-e514-45d3-9eae-154bd843fbf7,Same particular series red,"Hardy, Porter and Hunt",1974,10874,0,99,4,11,70,85
50eb9788-aa45-4443-ae59-e909f37f5ae4,On politics interest,Serrano LLC,1972,10673,15,19,1,1,65,170
89c4a2bf-968d-45c6-8deb-1bfa02b42073,Focus poor high,Ballard-Clark,1998,6082,9,12,11,11,165,210
2601ba15-7f3b-475e-b347-57340b328435,Out your minute actually,"Coffey, Porter and Cochran",2018,13166,10,16,11,11,25,105
1f38a3e7-d040-489f-9e94-9f3a758b7bec,Prove responsibility right,Brown-Bullock,1975,14470,9,13,1,2,55,180
057ec4ba-3522-428a-998e-1e050962a7db,Room prepare someone main,Boyd-Rubio,2005,1696,16,99,8,13,140,225
7ce43cb3-d9cd-4888-9385-9f1cff2eb1b4,Draw drop vote also will sit,Fields and Sons,2001,13748,4,19,3,9,10,90
e0daf945-df32-4172-84ce-69668cfc5eb0,Since already top business,Greene Group,1985,4667,4,11,10,13,30,165
599aaf22-2754-45f6-a9ca-c3d9ce65f582,Suggest beat government less,Rivas-Hampton,1994,13840,16,21,8,11,100,230
e62abb7d-7891-4c39-adfa-4ca8ef689a31,Shoulder study artist,"Adams, Graham and Byrd",2005,13634,21,99,5,13,70,215
c43fbaa4-6cb7-4b74-8d3c-86a8bf279866,Others debate tend sort,Bentley Ltd,1992,6685,16,99,13,13,50,65
a4323307-9009-481f-925d-ae1e0696b9ea,Buy lay lose lot red ever,Carter-White,1992,4158,20,21,1,10,200,230
ef1e2766-e151-4eed-8580-eb1efd290e05,Direction key store,Allen LLC,1981,14705,18,99,1,1,130,150
a84e0d70-78ad-432c-9167-be8f87353c9e,I nation participant half up,Stout LLC,1975,5095,5,99,14,14,45,70
f6a6d607-7bd3-4172-8206-2a1bce6d5d69,Movie first last,"Taylor, Carr and Conley",1981,3952,6,8,1,4,55,135
74b01bb5-3e09-4bc4-8ef0-6a46f2e5afbe,Change drive site,Roberson LLC,2001,9452,7,21,5,11,70,155
3e8ed166-c650-438d-a7aa-d79303634429,Although white lead social,Little PLC,1987,13267,13,15,11,13,170,175
d1b51b74-826d-4f25-87ca-989868307c54,Others name mission final,Richardson-Allen,2007,922,14,99,9,10,100,140
ad7dcdc8-1b96-4af6-8082-51e69976ee52,Those enter foot future run,Williams-Murray,1993,11763,4,5,8,14,30,130
a5844c42-08f3-429a-923b-5255e3c11290,Budget year reason girl,Garcia LLC,1974,1401,9,99,2,13,25,230
dc0c010b-b5f7-4d4e-8bb8-8277ef20f12b,I behind think language,Ortega-Trujillo,1984,11806,3,10,3,5,185,235
39a5f6b7-00e2-42ec-bb09-02dbd37df05a,Democrat cause culture rest,Hicks-Mccann,2013,13385,0,11,15,15,150,230
44f4d4d3-6d94-49b4-8f7e-a91d693cd8e9,Glass upon friend cell,Miller-Washington,2018,11581,4,15,2,12,40,80
4a196edd-e61b-433d-8d2c-e6d48e5d30ae,Report indicate education,"Gray, Watts and Williams",1987,6753,0,3,11,12,30,155
ceb5c123-ed28-4433-a506-19a6f5ae9f9b,Type international goal,"Lewis, Weeks and Hurley",1997,11134,18,21,5,7,80,135
ae1d5cc7-f9c1-4586-8452-4eaf86fdf0d0,Thank of why development,Vasquez PLC,1985,10764,9,18,2,12,130,145
e8e62de6-9da6-453e-9cf6-d167da47729f,Over picture create station,Rios-Morgan,1999,5050,2,5,11,13,60,190
35408eaf-5165-4338-970c-9a036d9f82a4,Including growth position,"Carter, Zimmerman and Reyes",1990,5327,2,10,10,12,155,210
fcb4d850-0591-4b1f-b6a7-6383a12185e8,Let own machine marriage,Crawford-Jenkins,1984,3699,8,99,2,7,65,220
dc6626e6-c2f5-480c-ba09-dc2afc7b75a2,Onto property future central,Johnson and Sons,2018,13655,16,17,3,10,225,235
77e1cabd-6008-4bfc-a681-da4776714921,Unit traditional reason than,Young Group,1990,13555,2,13,6,6,40,50
ef56c750-66ad-42bf-8726-fae678c15be9,Main somebody station,"Oconnor, Price and Patrick",1976,4066,18,21,4,6,90,110
de53d667-6ace-4e15-be31-dc92e0d53e47,Sit door Congress green,Stewart-Davis,2008,10017,3,14,1,12,40,170
5d31b499-afa1-43e1-a676-0f03e30407b1,Above new performance,Cortez Group,2010,8950,15,18,9,11,185,235
4b893f25-f379-4465-a217-dd37d7535b42,Include here manage,"Sanchez, Robinson and Jackson",2010,1088,7,8,9,14,80,195
0049fee2-8fc1-49f1-be88-304de97236b2,Treatment occur key,"Gibbs, Woods and Khan",1976,2212,15,99,9,14,55,230
38012f09-dcfe-4211-9385-a0c28ab2fd70,She toward TV eye step,Yang-Nguyen,1988,670,7,8,2,3,20,225
8a2e2940-065a-49e7-a007-94080b772bc5,Around strong beat,Noble-Palmer,2003,9842,3,99,13,13,55,135
a67d0de9-70b3-4766-873e-995aafd3d153,Seek attack himself,Price and Sons,1981,10203,12,13,1,9,225,235
ff0504bc-dbc6-4af0-9737-e38477075a9a,Decision bed when above,Martinez Group,1991,5700,0,6,2,15,15,40
810a1f37-40fe-4068-9186-781cdc285c1a,Something field anyone,"White, Baker and Merritt",1991,5247,7,14,7,8,65,170
a8e0c16e-2f1a-4281-a5bd-d5085c835be1,Fund pick seven catch,Wilson-Hernandez,2004,2864,4,19,6,6,55,140
486a4e19-444b-4707-bfd3-dcd4af81b946,Structure worry station six,Cross-Hanson,1974,6373,5,11,2,4,120,140
0c96fbc1-a4af-4f63-9a47-4dad5ba3685f,Various friend check occur,"Lee, Ortiz and Jimenez",2007,2415,5,19,8,15,130,195
39e294c5-a45f-47ff-a427-2124ceaad250,Past son statement back,"Smith, Jones and Spencer",1978,3358,2,9,12,15,35,70
4730f6a0-4b85-4eaa-b49a-26239eb36b20,Everything mission spring do,Barnes Ltd,2001,48,8,99,2,6,30,50
ac030fbd-0841-45b5-ab2b-9ac687cbb188,Hard tonight instead than,"Woods, Whitaker and Chavez",2019,597,0,13,14,15,90,175
a6383a1d-5fcb-42bb-8b0c-45b18f4a4099,Near process voice executive,Jimenez-Mathis,1971,4258,2,99,8,10,65,175
138596a5-697e-4505-aed4-039ec9107713,Production appear start,Jimenez-Hoffman,2005,13578,19,21,3,9,80,200
fa688f3a-6c99-4277-8471-b57d73125c80,Although at business bill,"Gibson, Nixon and Hansen",1970,3284,5,17,9,14,20,40
221810f0-ff9f-4f86-a01c-5259b85f4435,Themselves model rate yard,"Atkinson, Jones and Russell",1979,4397,2,99,5,10,35,45
a2f814e7-ae35-46f9-97fd-8b9578288c5f,Represent other charge,"Martin, Buck and Newman",1988,12278,1,20,5,13,60,185
9e93cb76-c0f7-4bfe-855f-1c8177fe3c63,Party prevent change,Michael Group,2017,8371,2,99,7,15,125,160
6ab0bb72-86b5-41f3-a4ea-76df73ba8938,List we support,"Miller, Oneill and Martinez",1975,11679,18,21,5,14,200,225
add9c1d1-37ca-44d9-926b-3e82d3e39b66,Suggest run civil,Pennington PLC,1994,5800,12,18,1,2,30,120
42ee1870-f055-4628-9dd1-220685d830fc,Standard once final,"Campos, Tucker and Davenport",2018,1574,9,18,2,6,50,140
db643287-d9c2-4c95-ae67-f01be9cc463a,But world name would,"Calderon, West and Murphy",1971,13162,2,7,13,15,20,180
25d1959f-a54f-403a-932e-a2115e2cfd31,List finish foreign author,"Nelson, Dalton and Benson",2009,7612,16,17,11,12,45,210
4bfddacb-6083-4f54-a782-3e983a8c9835,Form indeed bad reality,Evans-Boyd,2005,10307,4,99,3,12,155,200
d0f9a68d-8ecb-4bb8-a438-9905b7508736,Reach father treatment image,Cline-Holmes,1998,4701,11,99,4,12,70,145
e197a9b7-b018-4410-aa38-3d301c0feeb8,Return why Mrs,Rivas PLC,2004,7333,6,7,7,10,125,130
df9d682e-da11-4cd0-a263-b7c187111b00,Nor suggest wonder,"Hill, Carter and Johnson",2020,974,3,19,2,14,10,115
00756a0b-cfae-4fbc-83da-9d576e63297b,Site job get pressure,Gibson-Ball,2003,174,11,13,4,14,115,190
20d75354-2b9f-4966-a685-4b1fe8f47f4c,Decision fear board cause,Baldwin Inc,2004,11,2,15,3,14,50,60
7eecc5e3-3cbb-4897-a999-473f6061c3c2,Someone within simply,Conley-Hoffman,1972,12104,2,21,9,13,10,190
eb548db2-968a-4a13-9acd-439de7c70756,Place travel public,Coleman LLC,2009,2117,2,18,10,12,5,40
4e0f8562-ac85-482f-8bdc-836408b36bf6,Head summer popular,"Anderson, Mathews and Webb",1986,10786,4,99,10,10,55,105
5004c7e2-1caa-4de8-a424-b41e010c19d6,View food such institution,"Caldwell, Bryan and Fitzpatrick",1971,14107,7,99,2,10,160,215
7ab50c89-2295-4556-8dc5-2826af1ae7ba,Type song hear couple key,Ball-Anderson,2018,4279,15,99,6,15,20,160
980c12bc-a20e-439e-9db0-17c0118b6fbd,And response charge sign,Fowler-Wood,1973,7810,8,18,15,15,55,80
0cbe183b-5367-41e2-8d69-f3c8674a72c3,Color election leader turn,"Collins, Morales and Stafford",2021,543,11,12,3,10,20,35
0bc0f2e7-2d29-4825-b360-00f60c756047,Citizen act care water,Mejia-Sanchez,2008,3137,19,20,5,8,125,210
7df7169c-411c-4075-b922-cf23a4951732,It dinner growth,Sparks Group,1972,5065,5,10,2,10,70,75
6969f765-21ed-45af-9d81-b69502b49b64,Computer consumer president,Mclaughlin-Phillips,2005,4735,11,17,8,15,110,115
0b286742-28fb-4b1e-ad27-c9b5fd681f9d,Catch day walk even third,Francis-Torres,1987,6574,2,9,7,11,15,55
6a2bbcb0-d024-4566-9fad-7ab24f881a4e,Foreign like wide perform,Santana LLC,2007,3373,9,16,10,14,25,85
94aadf75-3a16-42d1-8f00-d2f9bd8541eb,Wide sort church,"Finley, Bond and Soto",1977,2669,13,18,8,15,5,15
e3228f81-d9f5-4050-ae19-3d84978abb92,Since standard site road,Bryant-Cohen,1970,11852,6,17,2,11,95,160
be8d9003-8b7b-4d88-a250-7657d666d092,Hair change believe,Gutierrez Group,2007,2560,3,16,3,14,20,210
92f37d4a-5cbe-43cd-b233-222332abf27d,Every subject boy,"Hurley, Santiago and Wells",2003,13176,2,4,8,10,25,50
1ed78105-48e5-49e5-ae3c-05f4fdc94014,Bring cut organization,"Stevens, Hernandez and Lane",1978,13537,6,14,8,15,80,95
45b657c4-5c9f-4a55-ba56-ab1766e913a5,Large among science father,Green-Arias,2001,13306,10,17,8,10,35,220
32f6ebae-42f0-42c6-bcde-fd3f6376f249,Grow news fact finally first,Prince-Jones,2013,5691,3,17,10,12,105,155
5107db08-51e8-408b-b5f4-aa789855f08d,Practice today environment,Miller-Thomas,2006,14216,18,21,5,8,60,180
895e4956-2900-414e-9e52-9a0df6fb17b7,Hope wind call white dream,Bentley PLC,1976,584,18,99,7,11,80,200
2c2a837b-c515-4a2e-9809-57cd55b34fa2,Director deep enough,Barnes Group,2012,4222,10,99,6,13,115,135
f8234a97-2c21-412d-af9c-7384510a093f,Take executive hot let,Evans-Osborne,2008,8991,10,13,8,12,80,235
f16938a0-3c80-48b3-a06e-9e452bea2c83,Art trouble me history,Johnson-Miller,1982,10545,3,5,7,12,80,85
40efe59e-4821-45a7-9cff-051eb5f16ef8,Base agency purpose money,"Ramirez, Serrano and Ware",1981,6820,14,15,4,8,30,140
b7567c60-c100-4d53-a089-9adcbf36fac2,Reach rise middle tough,Martinez-Parrish,2021,4996,1,6,3,10,200,210
9c2d3911-062b-4561-aaba-1351d9319a17,Section resource assume,"Cooper, Reid and Jones",2012,4369,3,9,14,15,85,195
939c2157-3cb1-4e7c-ade0-83406fe6c02d,Left office cost beyond join,King-Williams,1991,2505,5,99,6,14,85,200
ee7f26e7-ecea-463a-b51d-0ee8246301bd,Member ever contain believe,Lopez-Davis,1998,12050,19,20,1,1,60,165
36547c33-c8f7-42c5-bab8-358c15539c1a,Hospital learn example shake,Wall PLC,2020,878,5,99,3,13,55,100
945dbb96-4473-497f-bf30-b8265447dfae,Forward fact child do,Norman Ltd,1976,8798,2,5,8,9,10,175
34c65924-8fce-401f-90a8-94492dba0bb0,Join whom sea statement for,Reed and Sons,1971,14235,6,99,5,10,60,125
5890b685-eea3-43ec-b47c-f73ee4dc7e90,Real good cold gas,Snyder-Hill,2019,12827,17,99,6,10,160,205
f7a3a412-e0ac-4a5d-89ea-8df46e9080f5,Building possible wait role,Raymond-Silva,1980,5444,5,8,7,9,170,205
79de5873-b364-4ff5-b9e6-941a9352b43b,Develop much modern kitchen,Marshall-Salazar,2021,10440,5,20,7,7,160,175
e1bc09bc-9a0d-4410-a48b-c861a0f2a67d,Look section now,Hardin Inc,1980,863,3,99,14,14,20,115
4209710f-4927-4c8d-9fb6-8c451b7e8028,Others thus sort military,Williams Inc,2008,14880,3,17,14,15,10,130
39097f1b-33ce-4d8d-9977-7d05297d3e9c,Role discuss who traditional,"Wood, Jimenez and Hayes",1976,3751,12,13,4,13,85,200
64da294d-da53-45c9-98f3-94d54871cafe,Read story still,Smith PLC,2003,12290,21,99,11,15,180,230
0e912a2e-9a55-418b-bb4a-2b7fd3f86549,Management west president,"Williams, White and Kline",1997,14683,4,21,11,11,100,215
3e3b62b5-6ca9-4cf1-8fa1-2e9d138ac17e,Also tend school,"Green, Evans and Roberson",1985,8814,12,14,3,10,55,200
eeaa62c5-5bbd-49a5-a33c-21f4e03e3c62,Player enter most expert,Solis-Douglas,1978,11367,10,99,12,14,135,140
6f341253-f448-46df-81e5-59a6f731874e,Seek personal move low,Pearson Ltd,1990,4023,2,13,3,15,85,185
21ae59a8-2004-4560-a707-63b7767361c8,Word month well TV leg,Moyer Group,1995,1733,2,6,8,10,30,40
1b38e150-e1c6-443b-b86b-af4311dd467c,Represent like her per,Lopez Ltd,1975,2485,20,21,2,4,30,160
b74615e6-ba88-4d98-81fa-20632b98d9b4,At option strategy see,"Wright, Grimes and Clarke",1991,1833,7,99,15,15,5,230
1995b3c9-a576-4b65-a726-6eeb39805a6e,Red catch natural series,Perez Ltd,2001,1232,7,19,4,9,125,200
e85b6e4c-9a8e-4406-9925-009e5d849fdf,Realize which left improve,Taylor-Peters,1977,14627,7,15,2,6,100,180
734e72e8-2221-466e-b82c-b77032b3b09d,Movie yes increase more tell,Wright Ltd,1982,14540,14,19,2,13,155,210
2bef1926-c44e-4beb-821c-76fc0d9871b8,Development loss air,Mayer LLC,2001,11502,0,8,5,10,55,130
8faafc36-7b08-42d6-8f43-8aa25e43f05c,Few time against bag goal,"Bowers, Ayers and Parker",2016,1995,6,16,9,14,100,215
186350ea-e3a1-4fae-847a-a3f868475c2d,Have teacher let,Watson PLC,2017,7927,13,99,2,12,70,80
3841a74f-4bfa-46ae-bec3-fb2667d51e10,Hospital compare task,Reyes Inc,1980,8578,4,7,1,6,20,205
55c8d3aa-d683-409a-b8a5-12d201069b18,Act music lose pick,Bender PLC,2019,7474,4,17,1,2,50,60
ea35a02e-a9cb-4c03-a3bb-4343ea1508fc,Camera road a better,"Jackson, Sanchez and Scott",1981,1215,16,19,4,13,90,125
05e131ed-18f9-4c69-9f21-79d90a704973,Tonight away cold,Patton PLC,1995,7308,6,10,1,13,120,165
d4fce868-fbd2-43d6-b35d-383f7a81222c,Realize audience wrong some,Edwards LLC,2009,6369,11,16,2,7,100,130
e78534ac-ce54-4e88-80ab-fa982c0659b9,Bank star than something,Nichols LLC,2021,3216,14,16,9,14,60,105
a4c06d62-f7a6-495c-8262-52d8a898f4a6,Pm summer indeed safe,Atkinson PLC,1985,4534,19,99,1,6,115,140
06975a0a-e8e7-465a-8fa3-12c942d512b2,Left wife major leg,"Hall, Jones and Perry",1987,12665,1,3,9,9,10,155
26ec56d7-5052-4910-b6d3-962a03c5ab27,Not various trade,"Ramos, Dunn and Pearson",2005,3147,15,18,4,5,60,75
4ca08063-3db6-4f4d-8031-21f1bf467be0,Say country her investment,"Hopkins, Molina and Booker",1974,12355,3,20,9,11,10,75
bcaa63c3-190b-431d-9cdc-c3690ccffa38,Since help late,"Scott, Charles and Anderson",1972,11356,10,12,8,11,100,200
23c3b5c4-a985-4839-beb2-eaf175ac3aa3,Choice never letter,Martin-Herrera,1993,1855,12,18,7,11,160,180
8a97aded-21ab-4872-9f6b-62dd1b03bfa6,Value maybe end,Brown Group,2000,3271,3,19,7,8,40,210
324eeb7c-8b8b-441e-a375-6c898990875a,Act amount final,"Mckenzie, Floyd and Jones",1977,3145,3,4,5,15,10,15
4367454f-b790-4828-8924-36a4bd212e75,Arm form loss,Dixon-Parker,2016,3613,21,21,5,11,145,160
cb165b04-a9f3-4a27-8515-7cfb4c019140,Toward how go car western,Marsh Ltd,2007,12404,10,13,1,3,20,80
f6f59d7b-5b5b-41af-8cf0-6783f4474be9,Power account hundred score,Vaughn-Mendoza,1998,11338,4,99,5,9,25,100
889abb35-9816-4dfe-b4c5-21d226361dd5,Stay per three act,Carson-Foster,1981,14668,18,99,9,15,20,30
d81d628f-8006-4b13-a3d9-95cecf201d53,Heavy budget game situation,"Boyd, Webb and Lewis",1993,2254,14,14,2,9,45,195
e2246922-ba32-40f1-82a5-72b9cf242ca8,West mind forward ever those,Green Ltd,2005,13161,4,9,12,12,5,70
be233b12-e0b9-4434-96f6-17b819c96e4d,Minute hard who around whole,"Marsh, Phillips and Larson",1973,4572,7,19,4,5,70,195
95fffcb3-83bc-4ef3-b40b-44af15b0e95d,All store drive,Lamb-Ellison,1990,5601,12,14,6,9,70,140
000e524c-0972-4466-b971-bf70d4bcccd4,A western than hair him,Johnson PLC,2008,725,14,99,4,4,190,215
472b4edf-4d07-4d6b-8944-241f854d5d89,Decide hand old,Conner-Valenzuela,1977,4492,1,3,12,15,40,50
c17a0503-88c9-4d74-b483-f5e25efe62ab,Make us truth put reveal,"Rodgers, Garner and Roberts",2015,5476,13,99,2,3,120,155
165b71b9-b67e-48dc-bd32-366a76960c6d,Point kind pressure,Wade PLC,1992,13058,3,18,5,15,70,160
e6a4168a-04aa-4ee9-a61a-d1b3f0455112,Possible large pull know,Moore-Smith,1978,2127,0,99,11,12,185,205
e09fc3e2-45e0-4e52-9007-34f3b22cb6d5,White accept threat,Kane-Delgado,2008,3959,0,21,12,15,30,85
821575ba-cef3-4b33-bd51-e920a01623ae,Also pretty half company,"Daniel, Harris and Rojas",1990,12634,10,12,7,8,40,125
41e780de-1da3-44de-80d7-9df5fe5460a9,Ten word series company,Sharp-Fowler,1978,1865,9,16,1,15,155,195
20e36876-22ca-4b7b-9369-414049dc9e31,Bill pay work road white,"Patel, Blevins and Alvarado",2019,12727,10,99,10,10,130,135
42d8b25f-b68b-44e0-8f1a-0e4519acfb19,Partner always food,"Jenkins, Shelton and Nielsen",1977,11607,12,99,8,12,70,140
2be82dfb-12a9-4d83-83aa-171bb394354a,Health your establish,Bartlett and Sons,2011,5476,15,99,7,15,30,80
31152b0b-a61d-484b-9381-9eda1590c7e7,Reflect cell measure,Thompson Group,1992,14991,11,99,1,4,140,220
5fa70cd5-69ac-4f8c-9fed-df16aa72ebc9,Nation fight decide note,Tran-Benson,1981,189,9,19,5,10,15,170
a4de5b91-e6f8-4ec3-8834-4e1fb476b6bb,In sound term,Bradford-Wilson,2012,10959,9,15,7,13,110,115
173a2704-965f-495d-9ce8-074ce1cac237,Maintain two would,Dixon-Santana,1996,4943,10,16,12,13,95,205
f8376147-c089-4aff-aace-539e50c243e0,Protect green on thus,Huber Ltd,1975,2182,6,99,4,13,150,160
241dc399-9573-46cc-8b30-f5d53b30061b,Main mouth word pay,"Wallace, Tate and Gonzales",2007,13116,0,14,6,14,70,185
c608d194-97be-4311-a9da-727e8596f582,Action lay rule music edge,"Wilson, Williams and Sanchez",1977,6707,14,99,3,6,65,70
72f88d27-bb23-441d-8a9e-45a2a7533ada,Leader yet woman,Smith-Sanchez,2000,8858,3,5,6,11,145,200
34704dd9-7e1a-463d-b995-af633315aeca,Structure interview play,"Smith, Reynolds and Monroe",1984,8225,17,99,1,5,50,145
bc1a2683-623a-42b8-9ada-79f073f3798f,Must where help not,Molina Group,2001,3149,19,99,6,9,115,225
a049a4df-f626-4368-938d-01b22e41c9b4,Seem live much color open,Carter-Garcia,1970,335,17,99,11,15,35,230
3e6cf99a-19b0-4b07-8543-e9934c716633,Thus hit cut star,"Carroll, Johnson and Murphy",1994,3222,4,99,11,14,110,225
b4086fa0-40a6-4a54-9240-c1095996b376,Become stay evening,Cook-Thornton,1976,14810,4,9,3,12,120,145
