1b0e68e2-c222-4463-bf62-ef4a084354b9,Their cause spend alone,Ford and Sons,1992,5889,0,4,5,9,140,170
ec9c7e9c-99ff-4dbb-b51a-948bb0ba671f,Other natural evening,Braun-Jackson,2012,6571,0,15,2,13,55,75
60158f23-b7da-45ae-bf89-90be51f21424,Also history answer watch,Herrera PLC,2005,7410,7,10,3,12,50,95
435abbab-f4b3-4a9a-8e67-ebb6a7bdf297,Hold teacher lead growth,Schultz-Hernandez,2002,5890,10,20,6,14,125,205
1cbc081b-dbf3-4c00-9d78-af1738922356,Work arm usually air,Hardy-Warren,1971,12591,4,15,6,11,30,170
31a962f2-5742-4bca-850e-2804493fd180,Yes room deal,Davis Group,1989,3732,12,21,11,12,10,210
5aa7809d-3ddd-4a46-9238-b4c35f000ea9,Specific tonight between,"Stone, Small and Arroyo",1996,1178,11,99,6,7,140,145
450cc0b8-81b4-4b1f-b57d-a0a60625b852,Fish garden raise,"Vega, King and Miller",2000,4465,2,9,8,13,5,70
4a36c512-0a11-48a8-a858-3cf47c4c39ab,Discussion image front,"Mcdonald, Walker and Conner",1977,2642,4,18,4,8,35,205
9ea7abac-ec5e-43ca-bc43-1f81436739e9,Effort meet nice little show,"Wilson, Garner and Smith",1994,11590,2,99,5,13,55,95
3613da4f-05b2-442d-a297-37cf79a93ed7,Scientist explain eight of,Mejia-Warner,1996,8136,5,20,3,12,5,110
36e848ac-35d9-40d1-abf3-3aa40e00a9e1,Chair prove baby main,"Ramirez, Webb and Francis",2007,1679,2,21,12,15,45,110
3f96772c-e194-43d8-9aaf-ed8c5daed3f0,Town important real must,Ellis Group,1977,9556,6,99,1,9,70,95
a9ddbecd-037a-402c-b533-ae90d421954e,Animal although prepare best,Fernandez-Hughes,1999,8838,16,17,4,13,20,85
ded57e95-9646-4a1b-9a8f-a2a8b50ce96c,Call hard single student,Rogers-Chapman,2014,7617,2,99,2,11,85,135
d5bd0709-b798-4bde-b87d-cb7b950a3aa8,Say ready hotel top once,Cooper-Mcintyre,1998,13294,15,99,5,15,35,175
a86f2474-8bf1-4c8b-9576-27b9ca66ac94,Draw amount over,"Edwards, White and Barber",1978,4407,21,99,9,15,50,235
df8cd343-89cc-4daa-8823-84dd0056e79c,Take quickly film right,Phillips-Parsons,2004,6290,6,20,3,11,145,215
d55bc699-67f7-4029-9533-acce680b969a,Record my good four,Morgan-Henderson,2007,7566,1,99,7,13,50,170
b1797ecb-7d44-4879-b61e-0aeb8e1aa6d5,Dream than deal professional,Roach-Myers,1977,1722,15,17,1,6,195,215
d3c922a4-261f-487e-b042-c35676ee6e1a,Between various foot,"Mcmahon, Taylor and Sims",2020,13837,1,9,5,10,30,120
5028802d-73e9-4200-9955-e2fb3d8dc557,Plant name of than,"Turner, Porter and Hernandez",2020,6133,1,15,7,9,65,75
86c64634-d638-4f0c-b8a6-42c7e0305b31,Decision again as current,"Anderson, Munoz and Johnson",2011,9989,2,20,1,10,130,155
57c79a6b-5f2d-46fd-87e8-64f46c6215c3,Dinner so member agree,Garcia-Ochoa,2004,2778,4,15,4,9,50,80
f7310438-2303-48ce-aa4f-d485cdd9de51,Create performance thing,"Hines, Anderson and Wright",1992,1803,3,16,8,11,30,115
cfc5b6cb-eda8-4a12-aae6-b12ad9eee201,Scene or mind full list real,"Harris, Davidson and Cooper",2000,9847,1,99,1,2,70,155
9613bcc3-93e2-4f02-870e-6c3f06566317,Until head now down control,"Mcbride, Hunter and Sullivan",1973,9583,2,21,5,8,110,215
dc6eedb9-81e4-4401-89f1-85b6f04f5cc3,Approach so study,"Yang, Campos and Holt",2005,11791,8,14,2,14,125,205
86db5cd4-ccc0-492d-a6df-b44fc67c72ff,Gun forget fight but far pay,Flores and Sons,1999,10107,1,19,5,6,25,105
f3b8ca8c-a206-4882-93d9-d094ebd99a4f,If image whatever clearly,Johnson and Sons,2003,5551,4,8,4,6,100,165
8f7a7a72-7e7e-494d-82d2-1483932b8b23,Share this center final,Davis-Sanchez,2002,1662,5,10,6,13,110,225
e0e7967e-7d23-418c-8c2a-07dcc28b37af,American certainly live,"Gilbert, Kline and Floyd",1992,13541,9,21,2,12,40,50
62987d59-1aa8-4414-a595-ddf9789ae523,Stay nor themselves,Andersen and Sons,1989,4587,6,18,3,11,205,215
b4a6785f-4d25-43e4-a4cc-99a796bff2d7,Ready material at able,Bradley-Hudson,1981,6437,2,99,5,7,135,170
14b22ce5-6828-46f5-b46f-c79e44adfc58,Media little send,Davis Group,1974,7571,13,21,7,9,45,230
e9528091-e48f-46f8-a34c-44b7c9c40c0a,Form since tough wonder,Nguyen Group,2017,1011,0,14,13,14,15,105
adf3d8c0-0bab-44a1-b341-b83a6ae560ae,Minute I color sound,Simmons Ltd,1991,2412,17,99,4,8,50,205
147ee531-cfd8-4c14-8004-c017879882f7,Sound surface form head TV,Hanson-Hall,2000,4157,9,20,7,13,75,100
7ec0a6d6-9c62-48af-9587-66040abc5592,Step herself maintain price,Hernandez LLC,1980,9705,12,19,5,6,65,220
cbcc5ed2-c27c-4ec9-95fd-65dc543ccf71,Bank including level option,Soto Inc,1986,3959,7,15,4,10,100,135
9c6816bf-f70e-4ee8-8ffd-814c1d7b8e61,Music issue small dream hold,Hardy-Fletcher,1991,13154,15,19,11,15,90,195
bfa8bc5d-fc46-4329-b091-f6bc316f504a,Recently respond when,Brandt PLC,1980,11201,4,4,6,9,90,225
229dfb2d-fe35-40c4-a5e8-12ceddf7851c,Price wait fast car,Parker-Bowen,2012,5133,10,11,5,14,110,205
8c98a1bb-cb7a-40c8-8d78-21b0101cce4c,Happen adult far effect,Frederick PLC,1985,12761,10,99,6,11,225,235
ae10495b-ee4a-475f-b33c-deaf732f1213,Miss clearly likely reach,"Hopkins, Olson and Blankenship",1970,6526,2,9,8,12,90,155
a88b4582-17cb-467f-bdc6-6ee8038d5896,Thought on difficult,"Thomas, Gordon and Edwards",1983,12416,5,5,8,10,150,185
b0519580-e941-4862-9f6d-49d4f26e7f50,Station tonight note,Lee-Ellison,1980,7900,12,14,1,14,125,190
335e7cf8-5805-4fb1-b61d-37ae061874f1,Have learn marriage father,"Ryan, Salinas and Farley",2020,741,5,14,14,14,10,165
dba25d58-a679-481d-9aa1-b6c9949cf00c,Case finish dark maintain,Patterson-Knight,2000,13812,3,15,7,15,20,215
5cd52c84-95b8-466c-ba79-8454cc670af7,Beat industry they middle,"Campbell, Robinson and Jones",1970,8807,10,19,7,9,80,105
50de43e2-8e23-4780-ab36-91460bc918c7,Director maybe much mind,Wolf Group,1970,10884,5,7,15,15,90,130
50daf098-b6a7-4d5b-b757-010bb8dbcd0c,Defense huge stuff office,"Madden, Carpenter and Clarke",2019,6262,1,20,6,8,45,70
dfc2958d-ef47-4a42-b597-3abd47be8189,Mean process activity issue,Miranda Group,1975,2732,17,99,12,13,55,235
23ab7e07-fb06-4ebb-9fa7-5ff43eb4b6c0,Become class people sort,Rogers Ltd,1999,12655,16,99,9,11,70,90
6c519f2f-1166-422c-8899-cd83eeeca849,Color thousand pressure note,Scott-Shaffer,1990,11113,6,9,3,14,205,230
b26c576a-1644-4ec0-ac82-8daf203e0609,Sit travel great rule,Jones PLC,1979,3439,2,16,1,7,140,145
513bcfe4-008e-4f44-8351-96cc7cc382dc,Easy continue since,Edwards Group,2013,13872,8,99,3,5,75,200
90bec173-7b85-4d61-b29c-1608ebb4c0ff,Moment rule much,"Lewis, Smith and Wright",1976,14338,10,17,2,6,185,205
49a40e4e-7fc0-40a7-a19c-a40ca16cface,Democrat certain cost,Mccoy-Glass,1985,12665,12,13,1,7,5,50
990d0ba2-8f1f-458a-a24e-86d855299319,His idea increase,"Martin, Curtis and Mitchell",1999,6194,1,18,3,7,110,230
73d0245e-1ecd-47e9-b5de-fd36d1b6380c,You in after,Johnson-Tran,2018,8982,1,15,6,15,45,165
e2ddefd4-021b-47cd-afe5-092de47987c1,Weight nice subject buy,Thompson PLC,1989,13433,4,19,7,13,65,215
144d218f-a750-4774-9c77-bc1521e89beb,Road prove hand hot,Carey-Mills,1979,12807,2,14,4,11,70,180
edb9ee8d-805e-44ef-b169-b42a1c7821fe,Claim difficult power always,Quinn Inc,1970,4670,14,14,11,12,25,90
37687d17-5686-43de-8854-980e3c7dcdbf,Modern family later,Koch and Sons,1970,3823,18,20,1,2,75,160
0d8dd52a-5312-47e2-9f5c-9533b8bf1470,Staff evening face anyone,Dyer-Smith,1985,1054,6,7,5,8,55,205
e7620153-d54b-42db-bfde-77820339867c,Hot south official site,Nguyen-Turner,1997,6638,6,99,2,11,75,90
5a5f8a51-b9c3-4927-8ff3-59b9ae15a981,That public stage sense,Lewis Inc,1970,7564,3,11,2,14,135,220
cbe74d04-a01f-4923-aa14-3071d5d6c4e1,Size stage think event,Hudson-Stevens,1972,11174,0,17,6,12,65,145
9325db5f-e033-4ce3-b638-f6cc7480a51c,Can surface accept past,"Barber, Gross and Nichols",1982,6220,2,12,14,15,30,170
961e3371-6c65-490d-ad52-38e4657d8e3f,Mission baby begin century,Simpson PLC,1982,522,17,99,9,12,65,85
0f04b1a4-8184-4b36-8f7b-f5ac1d827ef1,Per bill enough human,"Simmons, Ray and Patterson",1997,6270,17,99,5,15,65,90
84b35f48-24e9-4a14-ad72-ff783cf866c0,Wind become ahead throughout,Adams PLC,1979,14947,16,17,2,4,65,190
a649f022-24cb-4994-a51e-9620d16fd270,Deal read arrive certainly,"Roth, Baxter and Scott",2021,9259,9,18,2,11,180,215
b6935c02-8d50-4581-96d7-70941548996a,Send yet simple can,"Brown, Griffin and Mills",1978,11190,5,20,8,13,35,75
17148707-7e3f-44fb-94d2-0a0032eb17e7,Relate lose performance,Saunders-Robinson,1995,6391,6,13,2,7,85,200
eb7186cc-fb47-4ab1-929a-d913d07c0bfb,Sort young exactly sense,Ruiz-Daniel,1982,1,13,18,13,14,35,130
9752d11e-f399-442f-aa88-1995466cd8a3,South down election,Hobbs-Obrien,1976,9958,0,6,7,11,50,55
27e0324b-1065-452f-b01e-6013be47135c,Point often protect manager,"Martinez, Garrison and Gonzalez",1970,5179,14,16,10,11,105,175
1b85c1b5-6ce2-42a6-83b1-0bdd11d37fd1,Meeting off store for those,"Smith, Brown and Caldwell",1975,12720,17,21,1,12,80,85
a921e753-41df-41ae-bdc9-d67a9b85eec3,Book five rate interview,Carroll-Weber,2018,736,12,99,3,6,35,150
0b65746f-6bbe-43f7-b61c-2e5105aee27a,A inside every plan,Graham-Pratt,2021,12665,8,18,2,2,160,195
6df1f7c7-87f0-4185-99c4-1a2e372cd7b8,Water class fear office,"Perez, Davis and Williams",2016,8619,1,18,10,15,30,145
a42a3813-ea0f-4e17-9176-639c25d2d56e,Black once magazine,Martin Inc,2010,1647,11,17,2,10,105,140
e0fd162e-af21-4a6c-84cf-4a90c4479cdd,Mrs option design class live,"Duncan, Lewis and Chambers",1986,3409,1,99,3,14,125,225
33db5f8e-92e3-4b28-9766-c9d88e516109,Final example about,Brown-Parsons,1970,859,7,99,9,13,60,200
b8402cf4-ffce-44f7-9f11-2fdff2fd2c97,Play data church,"Velazquez, Griffin and Whitney",2005,1968,4,99,7,10,65,185
9714abcf-1a16-4547-8ced-48a032967ad0,Collection story special,Vargas-Brown,1999,1015,2,99,6,12,110,205
6aff71e0-f1fa-4fa9-9057-f2b0e3a93aa2,Something a sometimes,"Mitchell, Lynch and Bradley",1975,10852,7,21,1,12,190,220
ed827b89-fcd1-44ce-a7a4-79a4b05bbb02,Hit movie benefit great term,"Smith, Hayden and Duncan",2004,2656,3,17,3,14,20,130
a31d8ead-475e-4b53-abe5-8e05656050dc,Of through back call,Welch Group,1978,7924,11,14,3,15,85,140
fd9f6b85-761a-43f5-a388-37a2f5a078c4,Point up realize easy card,Garcia-Williams,2011,7012,4,18,4,9,170,175
429b30dd-f0e1-4189-b930-9d38a2fd894a,House cup nor again,"Kirby, Jones and Perry",1990,13461,8,9,1,8,155,215
4715ec99-c282-4500-b0e6-d54ac382ea2c,South it significant,"Chandler, Banks and Jones",1977,4248,5,21,1,7,75,115
ebf81d0b-bc08-4716-8261-5b771fe03a5a,Degree spend cold which be,"Ho, Hall and Torres",1996,13954,1,12,3,8,135,155
a2ff7275-0b5d-4a09-a072-6d23fdebc7f8,Audience note teacher team,Kidd LLC,2016,12326,13,21,5,6,215,220
d9bfa014-18fe-46cc-ac7b-4dee67c35727,Knowledge party record,Morgan-Chaney,2012,2924,16,19,5,14,175,205
226331aa-125a-46e5-a54f-c18eea3e8af9,Light clear almost among,"Nielsen, Yates and Hamilton",1976,11898,6,7,3,5,60,120
d3558860-6a29-4be4-9426-2daf5d6d46d3,She skin two note,Kane-Stephenson,1987,5678,20,99,1,9,20,105
3c991b71-1579-44d6-adb7-df3d6bba06ef,Hotel life put reach,"Jones, Martin and Aguirre",2018,4646,20,21,11,14,20,95
0a6d4700-c033-4ddc-bc43-15f4de1930a6,Safe grow professor money,Carroll Group,1988,10265,14,17,3,12,175,215
429a6cd9-11a0-4796-8d7e-74c5ebecf7be,Force out rather level,Green-Fernandez,2016,7251,4,20,6,13,140,185
347cefc5-2add-4b73-890e-e6a5a8030112,Task point character model,Hill-Stein,1990,6187,1,5,2,9,50,130
fec81f61-0831-4035-bb7b-b6d2aef2f85e,Including rest least apply,"Lopez, Sims and Paul",1988,9406,9,16,10,12,15,190
b0c1b86b-866e-451a-9322-d50e962e2a19,Doctor say current what,Johnson-Davis,2002,12779,21,99,10,12,65,195
85aecce7-e31b-4ddd-8ed0-38ac96a15796,Although least your yeah,Anthony and Sons,1971,2724,1,12,10,11,15,130
00a2c397-3d3f-48f3-852e-35b6d37010d7,Artist television after,Martinez-Davis,1991,4155,0,7,2,8,175,235
aa2b2b89-5174-4cc3-8c4c-9e96249658ef,Spend face beyond kind leg,Rodriguez-Trevino,2019,9128,11,18,7,7,15,150
fb63e968-9f2c-41d5-a1ea-426c93071fac,Live dream for few,Williams Inc,2018,10169,17,19,6,6,150,180
39eabd4f-e8a3-4f9c-86b6-c11c48147bc4,Very third ball east pull,Perez-Armstrong,1989,3829,11,20,3,10,40,195
faea580f-f765-431c-9ac8-042292d66aac,Which man least use,Ward PLC,1995,2319,16,99,2,5,215,220
8c9ae34d-e02c-4cd3-b1dd-4b167cfe0005,Education force pick,"Crawford, Wyatt and Green",2010,2436,0,11,3,12,75,145
a2f97b6f-de78-4626-8f41-c02ab295e9eb,Event kind rest,Meza-Obrien,2009,1942,3,13,7,9,30,50
4c571ed5-f17e-47fc-b58e-a788292ba715,Player over born,"Hawkins, Smith and Gomez",2016,3903,1,8,10,15,115,145
12788f9a-0a95-44ce-accf-e019a6441579,Upon control rest back,Collins-Smith,1974,2256,11,16,5,10,10,20
fedd6352-47b6-4871-a946-74eb5b25a392,Nation your decade,Kennedy-Bauer,2007,12456,10,16,7,9,30,40
4fa066ee-146e-42b6-b859-14d8f0cbc091,Seem fund at,Leonard and Sons,1994,3581,5,99,3,14,70,80
4df1628f-0b37-42ef-8ae4-867ffe090d52,We talk director out PM,Navarro Ltd,1983,8743,16,99,2,10,130,170
f850b2c9-f730-4f36-b4b1-6149607536cf,When take road service,"Fisher, Rogers and Horton",2016,4706,4,99,13,14,155,210
68b968bd-22b9-43b9-8282-e38cd93fbe10,Turn direction class center,"Thompson, Jackson and Olson",2012,10437,15,19,4,10,120,140
4d7c4875-0780-471f-9afb-ea46c55ad4b1,Affect give low house dark,Garcia-Johnson,1976,13451,17,20,4,6,25,55
133576ae-f62a-4e99-8eac-74350e6e6b1b,Nothing report hair,Nielsen-Kim,1979,11249,11,16,4,12,150,170
6a39a535-330c-4521-b8c6-5bbdfd8c469c,Boy fall avoid anyone great,"Garcia, Williams and Jones",1978,11423,3,99,5,6,90,120
4edea3d6-159e-4a3a-8d50-c509263db8de,Kitchen program both,Jones LLC,1983,7947,12,99,13,15,45,160
62572265-a694-4230-89fd-2d83ab3170a7,Simply eye kind tonight,Spencer-Whitaker,1970,3588,3,19,13,14,50,115
b0c9d6a7-5ade-4d96-82cc-2f1e48c8cf25,Door news change western,"Frye, Sims and Gibbs",1974,10541,13,15,9,9,45,175
748313cd-5455-470d-a88f-dbfadfaa491d,Help debate take score,Wong-Dixon,2006,11059,0,4,6,13,50,110
dd145dde-1c24-4dd8-a04d-e8692ddcea2c,Character could in lose,Villegas-Henry,1971,2713,7,21,3,13,10,40
fb438e0c-ecd2-48dd-a800-8319d5f7895d,Least type sometimes,Edwards-Suarez,2001,6676,13,17,3,9,65,205
07585864-c9b5-4eb9-bb9e-0cc2c8f4cebc,Class father money seem,"Swanson, Copeland and Hobbs",1981,3670,1,14,5,10,120,180
a06e0f5f-f5b5-41fa-9dce-68048e20c97f,Cell travel near store,Hooper-Smith,1973,10233,10,99,12,15,55,110
348c7bcb-b757-4b0a-aa5a-6754cc61e803,Store happen student Mrs,Cox PLC,1984,7225,1,5,10,12,35,170
0edeb0ea-c0b0-4e48-b09d-81913db393bb,Girl at person political,Jones PLC,1991,3197,5,9,10,11,10,225
ae362108-1308-4599-ab4b-3d2fe08460c8,Message top small,"Roberts, Booth and Sandoval",1982,11466,15,21,12,15,125,220
a2bc7064-60c2-4026-a238-7cbae09b4e7c,Your prepare practice space,"Davis, Brown and Jones",1974,8331,0,21,8,11,60,175
d45c651b-ab8c-4ae1-83cd-0dc091e95751,Property firm mind life same,Sanchez-Young,1974,12963,2,11,7,8,115,155
1e0031fc-c462-4e19-af76-860e80550c5f,Issue order others walk need,Campbell PLC,2000,13528,6,12,7,10,30,150
bcef1d82-37f9-4c80-8644-cf129e729855,Thing product movement every,Stokes Inc,1992,3572,13,14,6,14,135,195
84b0c98a-139c-4ab5-a81c-b77d2413dd6b,Success according because,Flores-Dixon,2003,2399,21,99,9,13,50,165
f7e0b15f-87ed-41ee-a786-7fa5e1773425,Line result cold third lose,Stewart PLC,2006,14767,1,20,5,14,105,230
2f5923e1-5351-4b81-b737-926ad00a81fb,Control first idea,"King, Deleon and Gray",1973,6173,5,99,1,1,55,180
2765a259-c3cd-4f72-9b4e-171dca3e8ada,Today right computer no,Morton-Shannon,2010,11777,0,13,7,13,45,90
f507ab41-17e4-4fed-9404-ac3793bd908f,Any case education,"Buck, Scott and Garrett",2002,1117,12,13,11,15,90,115
1c84b85e-c7a8-4ee6-a8d9-1d78df7dd601,Me answer cup may accept,Collins-Stout,2010,13802,0,10,11,12,85,210
f3687a19-c252-4113-8118-1d0c775d1204,Help group read voice white,Rasmussen-Simon,1985,6567,7,99,5,6,50,215
a4669164-2c8d-47a3-b504-6300100003d4,Fact also off past manager,"Osborn, Watson and Jones",2018,14558,4,10,4,11,90,160
06620d47-a09b-440f-b4aa-103088cb9c1f,Ago dream similar,"Jordan, Bennett and Chapman",1971,3159,3,99,13,14,130,220
9d6814f3-7e28-4623-b78e-13586354e59c,Whom hope then guy,Navarro LLC,2016,1430,10,14,8,11,75,235
1a964708-7ae9-40ae-8be3-9af877073830,Gun explain onto soon test,Villegas-Brown,1979,2539,0,16,7,8,25,205
7aba215a-cb97-4e0c-8525-6fb664435fca,Visit official travel,"Torres, Bush and Hensley",1990,8407,12,20,4,6,80,220
49f23bbf-b0cd-4ecd-b7fc-b5bb41114eb2,Face week market throw,Nolan-Holt,1978,5396,7,99,1,11,10,110
13a9c861-141f-4f6a-9f60-c520631f44a0,Sea bill buy hundred yes,"Torres, Lawrence and Richmond",1977,133,12,13,4,5,45,90
b9895b76-aced-4f7b-9e3c-8ba3c83f1b68,Mrs event cause,Hobbs Group,2018,14297,0,1,5,6,40,195
6142ee00-171a-41c1-a902-93cdedb52e1a,Drop billion current,Mathews Inc,1977,2028,9,18,11,13,20,80
a2767274-1850-488e-9ac8-4c137869b435,Like notice not leader,Mccann-Wheeler,1990,3455,16,21,12,13,90,125
6c08a54f-7a08-4b40-87de-d5a59d7dc465,Source two ever,Nelson-Wilson,1989,8139,9,15,6,10,15,105
473adfd0-66ad-42b3-b935-8830077d1f71,Sound bag feel no,Anderson Inc,1990,7413,0,10,2,12,135,215
70c4bc04-a30c-4d3d-b8cc-ab1434a25d39,Need development pass,Weiss-Barker,1981,11935,8,12,6,12,20,115
af190b85-d158-496f-b350-982d485a9389,Town address admit tonight,Snyder-Rivera,2000,9412,7,16,11,15,95,175
2d9e41f7-9936-493e-9420-0a13afdad3e5,Catch hard girl coach,Smith Inc,2006,12746,14,16,5,11,140,145
08fea0e0-e9cd-4b0e-87b8-219016f1b653,Stand set hand trade,Garcia Ltd,1985,2694,16,17,2,3,50,165
cd5ea483-259d-41fa-95b1-f69bdc44394b,Color five thing close main,Herman-Williamson,2013,7021,3,20,7,10,110,220
973104b2-6926-4124-a4d7-d7e400805826,Goal throw perhaps economy,Lane-Schneider,1987,633,11,15,8,9,20,155
cf8cfd8f-3197-40c0-a1da-ba12beccd881,Law design in soon great,Hamilton PLC,1979,11420,8,9,7,12,135,200
347c4fba-bd79-4f0c-92be-155b58e8c33b,Provide can goal,Santiago-Nelson,1971,14377,18,19,2,7,105,180
5ab8b200-97fb-43d5-a27c-1b26055fc72a,Must here go best,White-Moody,2006,3211,7,11,8,13,65,235
722a63a5-4e4d-4970-9463-07f476c866a3,Fact should success fish,Kelly PLC,1999,8158,10,17,4,13,35,140
cf33875f-a6be-49ad-8c67-cd5a34d80707,Defense professor task,Browning Inc,2010,6624,6,21,2,6,15,110
404a9a26-638c-4fbe-920e-a6c0557d5bfa,Tend speak paper too,"Phillips, Carlson and Morgan",2007,2805,11,14,10,14,170,175
3278574d-722d-4a45-9d19-cd7f693376cf,Much little feel happen,"Richmond, Smith and Wright",1985,5211,1,4,6,13,155,160
6afa5fdc-9c54-4db7-a6ce-8ed259793582,More lose north open,"Anderson, Hughes and Leon",2011,12352,11,20,8,10,125,200
d3aa385e-974c-4f71-bbf0-27db20aea457,Beyond toward trial say mind,Vasquez-Hanna,2000,1468,3,14,6,6,75,200
f5e12e33-931f-4cc6-9c20-70a9deeadb98,Simply former scientist,Blackburn-Winters,2010,12109,14,99,11,15,95,190
c74b88c8-2b48-4942-a290-378d3a1d038d,Perhaps season street large,Jones PLC,1984,10613,4,4,4,6,35,110
0e810523-dc0e-43f0-8a14-93052431d97a,North decide in million,Cobb Ltd,1970,14813,2,3,1,5,125,140
6193f129-85be-4dbe-9cfb-98e29f451b2a,Name exist travel hand,Martin Group,1984,11463,2,8,3,13,90,165
8fcb8b0d-d6dc-415d-86e3-49104b3014d2,Smile bar second well alone,"Stevenson, Gibson and Rodriguez",2004,8342,3,15,9,10,95,120
6cd7e41e-8ad1-45f4-a10e-04e8cfbb0722,Item speech risk often main,Kirk Ltd,2021,8734,8,20,7,14,80,115
e2984eba-8595-4485-9fc5-43f69835ce71,Drive risk professor rise,"Nash, Frank and Kelly",1995,8321,6,6,9,13,120,225
b150b44a-491d-4196-b293-04ca93e55a88,Collection minute it affect,Scott Ltd,1974,644,12,16,9,13,95,135
ea01f924-0ce9-4d13-b217-a7ccfe368e8f,Thing form politics eat,"Lee, Clark and Wood",1999,5200,7,15,2,5,220,230
889c89a0-b33a-4ed3-8b0f-a2c229776f96,Field soon firm instead,"Russo, Cline and Briggs",2012,13378,9,11,4,10,75,150
4db404e5-eb17-46b5-b821-f228929c0abe,Rule red will rather,Pruitt Inc,1998,14114,8,11,4,13,5,10
ba9fa87f-8826-4bcb-a2b8-3e7d5fa265d6,Government tonight art long,Moran-Grant,1975,7732,2,99,1,14,160,220
4853dfe6-a7eb-4677-943d-df0195b3cd51,Majority ground next,Smith LLC,2000,6675,10,10,4,9,10,170
1c5d35b0-1d0e-431d-a9ba-023c482c0e9c,Part so win,"Washington, Green and Scott",1984,7711,1,19,13,15,110,125
c443954c-bbd5-4410-a7d6-b88af6faf577,Dinner dark dinner appear,Villanueva-Rios,1981,6258,1,99,13,13,100,140
2d789506-afe5-4af1-a0e6-f375044fae3c,Ahead along summer money,Johns Inc,2019,1329,18,99,5,6,125,225
1c8db15c-ed75-4ce9-9cae-af88ba744ec4,Trial late call record,"Johnson, Costa and Price",2014,14350,1,99,9,14,20,100
70fe2015-3665-460f-bf82-992b4ce24851,Cup upon build,"Kemp, Martinez and Fischer",1984,2014,12,21,13,15,65,160
29d42175-adb2-4eaa-ad32-31ae3cc55d7d,Office record window law,Bean-Long,1973,1845,8,99,11,14,90,220
52cd44dc-b940-481a-84a4-13659d50fe71,Me cell option development,"Hogan, Warren and Figueroa",2013,148,0,15,4,5,10,35
920ac541-c6da-4b49-bb88-9f317c785264,Discover front none nor,Sellers-Turner,1981,160,4,12,2,9,175,180
f99c2377-74c5-4a99-bfc7-8da9c8753661,Relate recently head bill,Higgins and Sons,1984,6930,9,20,4,10,5,65
885d9cb3-0ba3-4720-b412-d21c998bd655,Our wide bag manage,"Kelly, Wheeler and Cohen",1994,10397,20,99,6,15,85,220
44c89469-a797-421e-ab60-6f526236cd0c,Can as sing up kid,"Harris, Berry and Howard",1988,11924,7,21,6,15,10,220
af6d8c50-ee12-4340-8156-fccdb0196631,During officer foot evidence,Chambers Ltd,2010,9449,5,99,5,15,190,205
657a35ab-15b6-422a-bb5c-885536f76f72,Act cut safe east back,"Lawson, Taylor and Hopkins",2003,5568,6,99,6,15,50,75
96687806-930e-4678-ab79-b527d9ce0df6,Term they letter with,Wood LLC,1981,10975,9,14,1,4,100,185
910943d3-dec8-4773-a6d2-b2cf768c4965,Account star line nice,"Evans, Atkinson and Hill",2020,5634,14,99,11,12,145,195
a6439e21-666a-46bd-a332-1fd7c8f80b95,Part difficult theory hear,Mcdowell PLC,2010,92,10,99,4,7,45,190
70bda028-3f11-431d-aed0-5dcbd5339219,Rock present pressure year,Holmes-Walker,1999,12897,21,99,3,4,50,65
4c9a151f-248f-4a3d-8e52-5c6003ad2c04,Around agency or arrive,Stevens Group,2002,6727,2,17,5,6,70,235
ff3079f2-5dde-4635-88ae-93bb10281cfb,Lot turn he air really more,Smith-Bush,1985,2625,4,99,8,9,35,140
26a3da4b-993e-4aa4-b978-5a1a9cccf96a,Poor leg indicate,"Gillespie, Lowe and Clark",1989,3102,1,6,10,13,85,140
f3d63980-77d5-4d6e-b777-f6e02e8a3f21,Later real fact tax,"Price, Munoz and Townsend",2020,13049,12,99,3,3,10,130
aa958219-2749-44d9-bba3-b10a189ad1b8,Health score if a,Buchanan Ltd,1993,2244,16,99,8,12,165,230
54cfd2cd-697f-44d9-8131-80d58fcccbe8,Half wait deep while,Hall and Sons,1983,6515,1,10,6,10,165,215
5789054c-24bc-4518-86fa-6f760c10b868,Effort foreign but usually,"Jones, Hansen and Jordan",1994,6555,6,18,6,14,145,195
f45673c7-7c86-4f9a-8bb2-ff938f5c7174,To would fire current seem,Bryan-Williams,1978,14619,13,99,1,7,10,95
75b6f59c-8f2a-4402-9acb-0a8dc0564432,Seek deal high nor tough the,Gibson Ltd,2009,11590,17,20,4,12,80,225
cf4fd815-b145-4fa5-aa46-381a90c293c3,Truth treat sort southern,"Moore, Neal and Wilson",2008,14207,8,15,3,12,15,140
13bc0260-cda5-4740-95e1-da2f55dd213f,Scene radio power,Hicks and Sons,1989,12435,6,16,8,11,110,115
37dbbae1-bb01-46be-864a-02c59d11d922,Back out size sign middle,Diaz-Bird,1988,834,0,21,2,14,40,130
c876bfc2-2dc7-42a6-86c5-536fc04df168,Family month crime case,Mcintyre-Merritt,2006,13766,6,10,5,11,145,220
84e04b85-8212-4598-aac3-28530516933e,Upon in recent put speech on,Phillips Group,2021,6568,3,99,12,15,85,155
144309e3-3e8f-4157-ab5f-9c058a442e69,Occur buy yes deep his,Gay-Valentine,2014,13419,14,14,3,3,150,235
99f2c681-b4d4-4f24-9837-76e31a1354f2,Bar people on already no,Russell Inc,1997,3060,10,18,4,10,70,200
8e9aff21-e865-4f49-9f67-c6fa797101e1,Consider discuss just guy,"Woods, Coleman and Stewart",1991,5877,17,19,4,15,115,165
af95d917-5a57-4619-90b2-1a43e6f74704,Throw provide somebody drug,Wilson and Sons,1980,6486,8,13,7,11,150,230
9adedbf8-e345-4e7f-867d-466dcae6b261,Cover ask control bar,"Jackson, Davidson and Garrett",1990,3924,2,4,11,11,160,175
919937f1-a508-4692-b4d7-a79416c56d4e,Behavior single method PM,"Robbins, Lyons and Powell",2014,13229,0,6,6,14,70,130
794c3b3c-8fbc-4873-9c43-c52244ede932,Sometimes suddenly trade,"Simmons, Hartman and Martin",2018,10849,12,18,5,6,155,200
fe4ae09c-4fbe-461f-a494-78956a792eb8,Look mind authority project,"Wilson, Zimmerman and Smith",1984,5019,4,16,10,13,50,90
08a4c419-8965-4b09-bca6-dcf2f3bb0ede,Paper box smile another,Thomas-Williams,2010,12002,7,8,1,12,70,210
ce0302f3-bc10-41b1-9328-e12f99f60d54,Support picture he growth,Mccormick-Carroll,2017,12046,3,5,11,15,175,225
9694b7ad-071d-4b99-88d5-b7986ec7d620,Painting language notice,"Waters, Gonzalez and Dorsey",2012,6849,1,3,1,7,205,220
90f366c3-2db8-4869-8cba-85927180b49e,Until color carry next,King-Diaz,1980,2082,20,21,2,7,145,165
06e330e6-500a-4235-8322-b5bfd62c1863,Event coach stuff mention,Hoffman Ltd,2008,10235,19,99,12,15,80,180
c19fbefe-dc64-41f4-bcba-77d76fe1d134,Away minute instead,Miller LLC,1984,14013,9,19,12,12,35,205
4f1741e8-36a9-4828-aaef-9b311b7ec801,Pattern example investment,Stark Ltd,1985,11742,11,99,3,13,25,95
51d1c19c-3b52-4573-92b8-eec4d9ae7f0d,Arm learn your base born,Martin-Williams,1975,7960,3,8,5,6,155,165
0721f8a5-2a37-4c34-abed-bcfa3cb5f18b,Parent increase quality,"Bowman, Lyons and Evans",1991,6920,15,99,5,8,215,235
c593a07d-44d3-4c2c-98db-fbc58683e0db,Decide hard protect major,Thomas and Sons,1980,7209,14,20,5,7,40,100
500b4a2e-c154-44b7-95e6-76903d13b8df,Safe learn herself can,Adams Group,2006,1514,7,8,3,5,60,235
df11403e-9724-492a-987d-4f6a45f4d201,Tv physical appear machine,Welch-Hicks,2017,9349,12,99,3,15,30,215
e1d68599-ff25-45f7-aa45-aa0071642946,Space expect run key,Patterson Inc,1992,13354,3,9,8,12,75,180
63461d7c-d213-4f27-81a2-cf494d6abaab,Push benefit which former,Franco-Arroyo,1991,9206,5,9,1,15,40,60
7315219e-26e2-4ae9-bcb1-f1d3b15ff469,Within store interview send,Lutz-Kennedy,2003,5209,13,99,5,11,65,95
b3e2e530-7a73-439d-95cd-781b6ade4711,Show south voice first,Martinez-Austin,1982,6750,4,14,6,13,105,205
25a8fc21-b523-40d1-8e75-248968f37d78,True run fear,Martin PLC,2004,11275,7,99,8,9,145,180
fd1171ce-d908-40bc-ba87-34bcec42919c,Much live industry,Avila-Raymond,2021,7950,3,20,2,5,170,235
