61f99b73-bd0d-47bb-825f-8f788f5ebffd,Strategy draw benefit walk,"Page, Walker and Espinoza",1988,8704,5,10,2,15,35,50
5fb3d2fa-ca0f-4824-b218-d8a2bd8e32db,Building run drug after,Smith-Young,2013,13590,7,99,10,11,20,155
0251ac8f-e127-4c5e-9e1c-64284f6d12fd,Imagine admit child only,Cameron-Little,2003,3164,19,99,6,11,105,200
3ebdac14-f33c-416f-be66-0fd2e3fbb6dd,What enjoy hotel back or,Arias PLC,1994,12254,19,99,11,14,55,195
9a75aaee-54e4-4813-b155-5d00b78839e4,Include this clear foot,White-Howell,2017,5999,14,99,12,13,70,125
8f66fcf9-095f-48fd-84e0-0f374c74d3f6,Summer hand talk give,George-Lowery,2017,14738,10,20,1,7,5,45
eccc785c-b689-42b0-b0b5-c334f6eac093,Happy run together article,Welch-Cervantes,1975,10007,5,13,2,7,115,230
62ff2e6b-ad80-46d2-b5aa-a6ba525db902,Lawyer hit ago,"Carroll, Estrada and Adams",1987,5925,10,19,5,13,20,75
7d5f2d32-0aae-4914-bd9a-974f3269df87,Girl option discuss draw,Atkinson-White,1991,5700,4,13,1,14,115,195
49e444ef-cd68-4764-a710-2afeb3360dc1,Skin yes expect again,Lee-Brock,1996,2331,0,2,6,12,95,175
5992e10c-c5c8-4dba-8898-d076ab46d5a8,Paper far its remember,Mcmahon and Sons,2009,14305,1,21,4,7,30,175
b02c5c26-a817-4ddb-b75c-d6790beedc24,Thing after care able,Turner Inc,1971,3659,5,20,4,11,20,120
d81e51a7-434e-4416-b8bc-8138d7cc635e,Around hot only side dream,"Parker, Davis and Tucker",1990,7832,8,11,6,7,10,15
c3224212-46ca-4102-8a1e-9136fcd7b49c,Law listen however,"Foster, Lee and Sparks",2001,12204,14,21,1,4,160,225
cb95a7ab-d70a-481c-995a-32656b59aead,Drive situation sense could,"Thornton, Olson and Rodriguez",1979,8311,8,14,2,8,160,170
b4806ca1-2afd-490b-b98f-17e7cade81b7,Just former foreign,"James, Palmer and Williams",1988,8174,7,21,5,12,105,220
49171ceb-4498-42ae-ae83-a310de79bf6c,Laugh score artist drive,Gordon Inc,1994,13487,2,5,5,6,190,220
c8edef9d-e00d-4683-936c-6cc6f342ed32,Act building respond space,Bradley LLC,2005,12495,17,99,2,3,210,220
7b9880ea-a646-4a7b-9319-c9e7d104fc08,Alone hair since argue,"Martinez, Vega and Lucas",1976,637,2,9,9,10,5,25
b541ba98-8363-4e8d-8ac3-8fa4dc171e56,Carry let hold possible,Townsend-Carr,1973,4091,1,11,7,10,120,165
c208fa09-42d4-44b5-8294-30e1b83b755b,Herself imagine society,"Chung, Moss and Jones",2002,13934,6,12,3,6,165,220
08196e60-9dbe-456e-a266-7b8ebffc793a,Position sell discussion,Beck-Parker,2017,14078,11,20,5,7,10,175
173d8e67-ec5d-4b17-ba21-0371ab53417b,Cost no let,Williams Ltd,1988,7236,1,3,4,6,70,155
79529a52-f746-41c5-9403-0bbc4ab6088a,Land now cup image,Miller Group,1990,200,1,99,2,8,20,70
09927861-5600-4b58-aa23-f93a00f1d9a0,Do population dark against,Hunt Group,2006,8090,2,99,4,6,45,220
b200e1ca-62d9-4ec1-8022-cf3c9d802212,Man paper fire create,Jordan Group,1994,10778,4,16,2,15,35,65
e37b0040-bc4a-4794-bb65-1d7cdfd051bf,Land specific participant,Smith-Pineda,2011,5110,2,13,4,10,25,70
07f801c5-e356-4040-8ba1-73d2e9c8e08a,Become prove current occur,Maldonado-Cooper,1978,5024,18,20,12,13,40,145
5ea0932f-3115-4448-a6cb-bdcc15cdb771,Both meet knowledge sort,"Perez, Crawford and Davis",1970,3138,4,8,2,4,120,220
f10f87de-2aaa-497d-993d-90c1c760f411,Position offer appear leader,"Collier, Villegas and Lamb",1986,4168,9,13,8,9,15,175
3ebb26e5-df1c-4ce2-b608-06807d3d6c33,Most president blood when,Arnold-Herrera,1970,10850,18,99,3,12,15,100
7e49dc1c-c754-47ca-b3ca-fd9b871a9aad,Chance place only program,"Mccullough, Jones and Buchanan",1976,12903,0,7,3,4,90,105
b878e24b-177a-45ac-9050-db65bce0c598,Shoulder news Mr end black,Johnson LLC,1971,6350,11,13,7,15,30,150
7c0afe05-752e-46f1-8852-1102bb594897,Huge smile soon especially,"Parsons, Mcmahon and Moore",1990,835,12,99,7,9,30,80
824e4335-68b5-4cbd-8d56-7c4b651c2e64,Fire question my citizen,Shelton and Sons,1985,4782,1,4,2,13,160,165
d89d0d2d-1600-4236-9f32-ba4b62c1bfe9,Fund tree player billion,Johnson-Wells,1977,5431,2,21,13,14,35,225
ad99e3a2-bd3f-46b6-931f-1531c24a85da,Draw free success,Sparks Group,1996,13157,2,7,7,8,175,225
55502c87-c15a-4a38-9f7a-a5a850654952,Reveal him general,Rogers-Wilson,1978,6198,0,4,6,12,15,225
5a9ce1a8-5056-451d-bdba-07f27da9a044,Sing modern market hair,"Sims, Nguyen and Phillips",2003,11460,6,16,7,13,100,175
5007b50c-b276-497e-ab8a-72522492e889,Above hard best economy draw,"West, Burns and Perez",1988,14020,14,17,9,13,30,190
2d79d86e-8bc9-4c8e-8c70-45920cf67b96,Decade place seven able his,"Holt, Munoz and Hays",2006,3053,9,13,7,8,50,135
121c6389-6111-40b5-8e74-f627356021f6,Protect smile window drop,"Garcia, Murray and Zimmerman",2016,9204,21,99,7,14,50,125
a77ddd2f-7372-4145-90ec-f9f9bfb06bf8,Amount should little call,Tran-Gillespie,2010,9394,8,17,3,9,45,85
eeceb39e-b7af-4f5f-854d-37f61212958b,Green type indeed,Adkins-Thompson,1990,6875,15,99,4,12,165,190
5389e96b-2b54-403e-b2ad-5ccd9bab4dd6,Us him begin,Anderson Ltd,1975,11074,6,17,12,14,60,70
a443dd1a-2453-41f3-b3d8-fa3d9362caa6,About face item wall,Knapp LLC,2009,4511,0,3,11,12,130,140
8be4c735-1b8e-41ca-a7e5-e538377eff1b,High expert civil talk,White Inc,2008,11277,11,13,2,6,35,190
f0bc190d-c082-4a91-a435-e55b2983d787,Stock government wall land,"Estrada, Gutierrez and Spears",2001,11989,13,16,5,13,40,130
016c4a2d-6f26-4ea4-bebb-f9c4ad09dc92,Wish institution have poor,Baxter PLC,2020,10753,5,11,6,14,190,200
254f2333-c15d-4828-abb1-6cedc409b8a4,Continue both talk agent,Preston-Velasquez,1986,2887,3,13,8,9,55,70
8a15e66e-c2f7-4b8e-805f-627f55a274fa,Report level church need,Daniel-Chambers,2017,3233,8,14,12,15,85,135
cdc90755-c349-4093-bffe-8192ee9465d5,Central power nothing old,"Scott, Jones and Kim",2021,11660,0,9,12,13,115,190
b3c72ef6-d510-4f04-86d9-c689cfda029a,Author economy evidence get,"Smith, Bradley and Ewing",2007,12261,13,99,9,12,45,120
0a6f2973-300c-4756-9b9a-198257f3d50a,Protect the claim describe,Powell-Brown,1995,12119,12,14,3,14,40,70
a95af243-1c29-4373-8f44-3618a0ec9cc8,Sign start business no with,Clark Ltd,1998,14630,2,21,6,7,120,145
d658ef21-e2a1-4aa7-a83a-aecd7ed68ff0,Sure simply check actually,"Hamilton, Sherman and Long",1974,14366,11,21,2,15,195,215
1710453e-c323-4d26-ab40-c50727890a92,Election politics various,"Williams, Smith and Kim",2006,7059,0,9,11,13,90,95
a4b39d43-1c67-4878-bb36-3b7660c6a218,Institution modern foot team,"Hopkins, Hardin and White",1990,11457,8,20,3,7,30,55
dcdb3630-8112-49b2-9b9f-57567de9458f,Serve the large answer man,Rich-Ross,2003,3192,21,99,13,14,175,215
105877a8-e2c8-436c-9549-a55a3295f78f,Help woman after rate,Lamb PLC,2000,6487,0,6,6,14,165,180
372d57b3-9c6a-404a-b93e-e6ddf4c51b2c,Expert your that,Holt PLC,1979,2807,13,99,7,9,35,125
93fae81d-acb0-4b83-8c53-d0c161fd2128,Believe run beat past,"Rodriguez, Kennedy and Wood",2012,11617,13,18,5,8,55,75
9f155f7f-4d2d-4b50-83e7-979e6689caef,Pull available bag,"Morris, Tran and Gonzalez",2015,5610,7,15,1,13,35,195
66771b28-0da2-4ca3-bafe-e4651b84534c,Day current leg,Krause-Brandt,1970,9522,20,21,9,9,110,175
9d455658-43f1-45df-8fc2-4c7558eb661d,Memory environment trip,"Ward, Ruiz and Estrada",1981,2385,18,99,5,6,45,125
d8bf4281-2be2-46fa-a1a3-e80aed9e7458,Near scene pressure half,Wolfe LLC,2000,5325,17,17,5,14,95,115
28bf405e-3468-4a38-8c52-3be562ea409f,Hope wife mind lay,Wilson-Burton,2013,158,16,20,2,13,65,90
d910ac0e-ac76-4c46-8903-988ce112ec4a,Just try pattern none others,"Payne, Munoz and Hernandez",1999,4264,11,16,4,9,205,230
c1dd792a-2a2e-4088-9846-f99e752eab20,Within goal its price,Williams Inc,1985,9051,12,99,4,4,140,180
ca39e49c-a604-4d15-b421-3b7de45a7614,Impact chance point,Morris-Mccarthy,2003,1331,8,12,2,3,45,175
e616e06d-99b6-4a12-9612-bce9367b2811,Get owner well,Roberson-Thompson,2017,7060,7,99,8,13,20,220
1e86d89b-0bee-4ebc-8bf9-1de53a7e2aa0,Grow must risk memory,"Norton, Brown and Herman",2002,3318,6,99,13,15,5,135
7be06b32-0a58-444e-a893-bd11621b7a15,Hope do get east decide,Solis-Evans,2012,884,3,11,4,8,20,175
d8634840-4e5c-45ce-bf1d-630e1428aa6a,Now measure peace draw loss,Olson LLC,1985,9533,2,99,3,6,50,150
40095f6a-529f-4253-b481-cceb839d814c,Tell decision close involve,Anderson and Sons,2007,932,2,6,13,15,40,150
1e526786-c072-4b44-8890-47fb698ed50a,Public decade free close,Mathis-Brooks,2010,5980,5,99,2,11,10,80
df59a1e1-8d3a-4f39-a734-459a4080cbb1,World place born different,Garcia PLC,2002,7939,18,99,1,8,65,210
6c8d7e2b-3113-4074-96f4-f819ee3f2dab,Most home maybe eat join,Calderon-Williams,2009,1913,2,15,4,6,115,215
1f4c7824-f479-4afa-b4ee-b222acdd9688,Top center tend,Sutton-Edwards,1994,10949,1,99,4,5,75,85
2204422c-4953-4f47-b426-d9fb3ea0e36d,Card ok it both,Christian-Hoover,2017,12744,14,18,7,11,180,190
c3cc75c6-eada-41a8-8125-6c0467d97dee,Someone own cup who,"Bennett, Greene and Moore",2019,217,0,13,11,12,105,115
ba41df4f-8428-4641-90f4-cf2b9b7dfa17,Five hard reach side,"Owens, Murray and Brown",1980,3806,0,99,1,5,180,185
9ecbe1ad-69bb-4cde-a7f6-651bd17c5f6e,Prepare laugh son picture,Jefferson and Sons,1993,4828,13,21,11,14,25,55
5968a1d6-e4d6-419b-9b9b-6347a9fd4f62,Assume ability the discuss,Lawrence-Thompson,2007,3005,15,20,2,12,75,90
10f84eb3-f376-4ee7-ae13-02dfd66006f2,Walk gas same eye,"Smith, Woodward and Woods",1971,8732,7,12,9,11,60,135
b9bd3aaa-37da-41b8-a881-435c0e90be84,Edge little at,"Marshall, Hernandez and Simmons",2010,12497,3,12,8,12,125,140
93370971-b494-49fb-8e2d-34a9c1c9dda6,Situation adult beyond goal,Morgan-Garcia,1978,12517,13,17,6,7,185,220
7bbb41e2-8ee5-4a7b-b001-679b5ea3e526,So reduce heavy go trade,Sullivan Inc,2001,6914,13,19,11,13,65,105
08b74df4-d2c5-4ed9-88c6-b7c06830723b,Son pay natural us,Allen-Houston,2021,14838,3,16,8,11,145,155
93ddc1dd-13b7-4080-b758-0ccd890abf87,Rise letter read,Scott-Wells,2016,9194,13,16,12,13,70,80
047f5a8b-542b-4f37-af21-78af27f125b3,Energy discuss final,Gaines-Richardson,1989,13639,19,99,7,13,10,145
d1178104-0a87-4b11-bb1e-37afe5241ad7,Fight study across official,Hall-Rangel,1981,4195,12,19,7,14,190,195
6cbf0e61-3668-4ea3-8e3d-5d1cc0596edc,Yeah throw into these,Knight-Thomas,1970,3241,0,14,2,3,130,225
c5fe1c63-2fe6-405e-936a-0bb717186e79,Defense crime product next,Ortiz-Solis,1970,9430,2,2,1,12,80,180
0abe2dbf-62d5-4a6e-94b8-a81c7655f4b2,Popular front choice phone,Stanley and Sons,2019,8224,17,17,11,13,55,125
be75a47b-2346-4602-a030-e2f146df998e,Region arm purpose,"Powers, Walsh and Adams",1995,6665,6,99,6,15,145,180
cabb459f-97f3-4bbf-a569-09e17b9af743,Security three through pay,"Mayo, Garner and Jackson",1988,275,11,20,2,11,15,90
ff544c88-7c43-488a-b511-ea2ec9e1a133,Stay through job,"Carlson, Kennedy and Garcia",2014,6028,12,15,3,13,115,140
794c3d7e-4f16-4960-9ee6-3b3d26dbbc66,Arrive walk value,Oliver PLC,2003,14216,20,20,10,12,85,210
e6246acc-082e-441e-b462-7d121d0014ff,Can reflect high garden,"Anderson, Peck and Obrien",2010,11662,8,17,4,8,55,155
93ead536-ef98-4b00-afee-8f74dd2fb418,No win sure where difference,Johnson-Stuart,2004,9988,8,18,2,15,190,220
c38c1c24-580a-476b-9c78-c725b67aa75f,Draw positive perform rock,Ramos and Sons,1971,14782,6,7,6,14,120,225
32eb10e6-25b4-4383-9bf8-02969274a9a9,Wrong necessary shake modern,Clements-Adams,2008,13885,18,99,1,13,60,160
7432d696-3147-4d7f-a825-c5ab5eacc4b0,Good office sell,Melton-Maynard,2002,9071,0,7,2,13,140,145
368fac36-3c96-47cd-ae04-4b617f4db6a0,Also trade message itself,"Patterson, Armstrong and Barnett",1978,2834,2,4,12,12,110,115
ca34baa7-007b-4b12-a911-55d135dbc28f,Base month party push,Payne-Kidd,2009,3627,11,99,7,12,90,120
d22e92c0-b158-48a6-8410-e10905932b61,Oil unit standard certainly,"Gallegos, Nelson and Macias",2008,11786,6,16,8,14,40,195
6b90f4b6-2943-49aa-a1c4-92d37eba20dc,Even enjoy medical dog,"Ramos, Harrison and Adams",2012,1079,13,21,4,7,90,100
b4805e7c-24cd-4998-9ed3-71b30773acff,Audience establish win,"Perez, Armstrong and Carrillo",2010,7787,13,99,5,7,60,115
13b11500-28e5-4cf0-a8f5-7540dcf09e37,My data likely painting,King LLC,1981,6523,5,11,1,10,85,215
95b19d1e-d8d0-4566-953c-f6b8c4897536,Material name it total,Mendez-Keller,1972,12009,9,12,3,5,5,120
c7edc600-8895-40b1-803c-0f6c15e55681,Word article just,Cook Group,2012,9762,6,14,6,15,25,155
7ce1679f-c0e0-41a8-8c6b-50d98bc83b23,Month gun upon travel,Roberts Group,1993,10042,4,16,4,9,20,130
d432cbc3-b9ba-4fd8-9fc7-4ae731832eba,Her value place since a,"Reed, Sweeney and Todd",1986,12939,12,99,2,10,105,125
8a84d89e-649e-48fd-a6dc-819334193066,School suggest development,Walker-Chase,1974,6047,2,15,12,12,55,80
e16808f9-488e-409a-828f-b9b1ae5fa798,What continue in,"Armstrong, Hayes and David",2021,316,8,21,2,15,30,35
8ffafacb-23e6-49ad-ac72-7af6a7bcf42e,Where hundred law home serve,Thompson-Thomas,2006,8087,9,12,7,8,50,225
df4d4d12-eed8-4ded-a44b-11bc1e43b1d2,Life TV present action,Miller Ltd,2000,8860,8,99,6,13,30,170
b801948c-9336-4b9a-88ab-5df7ca385e04,Staff hear spring top,"Cole, Reed and White",2021,2393,14,18,3,8,60,130
ab05c4ed-46ec-4528-b8eb-996d53100cb8,Reality write wait,Hanson-Heath,2018,3712,8,8,2,15,55,60
72a51184-e625-4256-9afb-7a95c441b4d0,Somebody parent company,"Palmer, Anderson and Clarke",1989,14683,10,17,3,15,65,125
aca7a6a9-a7f7-4c12-ab28-d7d52bc8a2a5,Able kid study issue word,"Johnson, Rios and Aguilar",1985,3756,9,20,6,12,30,140
96f37a5e-0fb5-44ad-8fac-51ee7a195a82,Power book product PM lose,Foster-Wallace,1979,13721,10,14,2,8,185,200
56d54274-45ca-4140-a75c-5955eba86865,Ask expect later century,Gonzalez-Guerrero,1973,8161,2,9,7,11,45,190
3b7fc9a6-daca-42ef-bcd4-b176e420bd00,Use stage draw magazine size,"Brown, Hall and Oliver",1972,19,3,99,1,15,105,155
e7050c9e-5001-4c9a-9389-2d0dc7f0e536,Discover available fear guy,Garrett-Levine,1991,14336,1,17,4,11,15,45
498e0f13-32f4-4762-8dab-79534ad08fe6,Case it particular,"Ramos, Armstrong and Horton",1986,10973,0,2,4,11,60,180
e953bb92-6b90-493f-9cd4-699aa9dafd02,Threat economy training,Berger-Cameron,1996,3570,2,99,3,5,30,105
342d2823-40dd-4e3a-951e-d8ec28a0763f,Sort trip order share,Frye LLC,1975,3129,7,13,9,11,100,170
2721faee-991b-44cc-8b91-10a679fd3985,Some late then city cup,Thompson-Hendricks,1986,9590,14,21,8,12,100,205
93080c6f-a53c-4d37-9474-3b633c724d79,Agent billion stay,Edwards Inc,1996,13983,12,19,5,12,215,220
c7dafcc2-1da7-487d-893a-0f06d1fa1e64,Tonight tell item red,Anderson Group,1976,14544,9,16,11,15,45,50
2e0f7fa5-1264-4da7-90e6-b18805816c2d,Bit leader end see,Figueroa-Herrera,2007,4404,13,99,1,5,40,60
f5022426-73a3-4f3b-8ec8-c0361edf0235,Probably card them,Murillo LLC,1997,3337,5,99,4,11,170,185
99e697fc-81d0-41de-a809-c46b7255f5b2,Thing produce religious,Castaneda-Park,2017,14480,13,14,2,13,20,60
b3507090-31d2-4e5c-a551-149fdaf05c55,Green evening ten work,Day PLC,1982,14173,5,99,10,13,190,235
7b2bf1d0-8e9b-4cc2-b0cd-1a7fa5c347e8,Break analysis brother she,Tucker LLC,1978,360,5,99,8,10,65,220
5251dbb8-6cb4-4d96-bf17-5c7647b2a3dc,Meet media suggest exactly,Ortiz Group,1997,7242,4,9,10,12,30,160
9b8878a7-fb1b-4df4-8197-7eba4e0a6e64,Guy also seem politics,Dominguez-Kelly,1971,4926,21,99,2,8,15,90
5d8c666f-9385-4585-8eb3-bc769de9d4d2,Yes receive about money,Summers Ltd,1991,12345,20,99,4,5,155,225
c1c8e9a0-ad15-4098-b6a9-671a7701fc17,Control fine fill there,Perez-Patel,2010,13374,13,15,12,12,65,115
f7dfa432-4ac9-490e-98cc-3bf38378a682,Space hear plan Mr,"Goodman, Copeland and Harris",1986,3730,11,99,9,12,115,145
4fa955ad-803e-46ee-b688-1d524ffc8ac7,Film animal yes be shake if,Torres-Cooke,2021,6249,2,4,4,11,85,130
51928ce4-cc97-4b91-9abc-c61f615b34e1,Federal own couple somebody,Johnson-Alexander,1999,3831,3,13,4,7,10,55
edef03fc-e8a0-4785-8041-f3cb74373fc2,In value mother deal,"Young, Williams and Jacobson",2011,14969,19,99,8,14,105,115
68d1bdde-5c87-43bf-811d-dcd2d245b20e,Wait statement television,Morales LLC,1999,10285,2,7,2,9,90,175
f6cb78ba-56e7-49af-81a2-6708d6eb98c4,Toward old recognize,"Lyons, Anderson and Ramirez",2008,3631,12,99,14,14,170,190
0b29b131-ce6a-4b99-b823-eddec5015318,Test need turn time parent,Jones-Butler,1997,11613,11,18,9,13,125,190
27718936-00c7-4a06-a338-ccb1a4ab373f,Set federal long fly network,"Gonzalez, Leon and Velazquez",1996,7835,6,16,1,3,130,210
e115e7ae-2b5b-4f11-bee1-c0322f70f874,Answer mind deep sense,Nolan and Sons,1999,1490,0,2,1,4,35,135
96a5a1ce-bc07-43c7-ac98-18e1749db611,Air seem surface game bar,Chan Inc,2001,1701,10,15,9,15,25,150
a294909d-2e75-4a17-9985-97dbcd633620,Medical them no,"Cox, Harrison and Hart",2005,195,17,99,4,9,40,220
5e205e32-9ce8-44fe-a389-d32cf12182fc,Stuff several today of,"Griffin, Brandt and Wells",1999,4406,11,11,6,6,160,215
efdd6334-397b-451e-87ed-954231fdaaf4,Feel least less north,"Smith, Prince and Tucker",1992,9768,0,11,3,10,60,120
ed89b20d-2869-4395-8e2a-9cec309250f3,Agent party bank focus,Bennett Group,1983,10500,15,99,5,14,125,180
85f8f962-ade7-4448-bc9d-07b01ad40817,Wide note center hotel claim,Miller Inc,2004,797,17,19,3,10,135,215
5e8484d3-fc9a-4061-801f-7e1f52cc4012,Task great thousand sea,Miller Group,2011,2266,10,14,12,15,35,110
4de30afa-26c6-4235-af20-46f1b428ed0b,Perhaps network hard have,"Stone, Garcia and Hernandez",2013,3869,10,16,2,14,190,220
78738550-2ee9-4f27-bde0-815194016531,Best exist education single,Medina-Cabrera,1983,766,0,99,5,5,90,215
55dbcd15-6f10-4186-89f9-2fb20c2c6e70,Brother themselves agency,Roberts-Perry,2015,9413,19,99,1,4,15,180
eba5a141-9d14-4738-90b2-7c15413a7790,Will hundred mouth its,Obrien-Sherman,1997,2394,5,20,1,5,160,225
0cd868a1-d087-4467-bfc2-0b96a73388b4,Purpose hope green lead,Arnold-Mayo,1971,1167,1,99,6,7,155,205
0e52d019-879c-48d4-8b65-4aa1ce821561,Property including hour fire,Smith-Holt,1974,14917,3,13,6,12,110,180
435542a9-9117-4137-86a9-e5a91173e083,Husband then wear city court,Walters Inc,1972,6283,0,99,10,11,105,210
0105edc0-d925-404a-a2bd-3854dd5df244,Picture night low,"Jackson, Lopez and Hamilton",2008,1879,6,99,10,14,10,75
b5c9c848-f654-46d1-b1f0-1d4f971302d9,Few war series into,Brown and Sons,2005,3864,14,20,8,15,120,210
d12ff2e9-e9c8-4e06-ae60-f3b181484b02,Easy up laugh democratic,Gordon-Davenport,2019,1468,13,16,10,15,95,210
6eaf17d5-7fdb-4a12-9049-38a82ab57198,Wife ever people,Sexton Ltd,2009,13863,4,12,5,10,35,160
f96b09a6-dd8e-417e-889e-e533573bdd72,Resource rise able season,Shelton-Fields,1988,11139,2,99,1,6,110,165
a66e0681-7762-40af-aa03-1e0d6df3681a,Science growth kitchen same,"Dunn, Rodriguez and Berger",2017,8635,3,13,1,14,35,45
e6f89acb-56c8-47d3-82f1-aed33beaa7c0,Thing sing safe because,Huffman-Peters,1977,10679,7,99,5,14,120,135
da49d56d-c393-4306-a518-b735a9b8b6c1,Race game yeah play similar,"Henderson, Calhoun and Santos",2011,7095,8,19,1,10,145,175
220b0d8b-0521-4a1b-929b-540ce998627d,Management down five,Hale-Miller,2008,4200,5,18,5,8,15,30
a73b804c-cbf4-4f10-843f-32da2133aec3,Conference speech blue,Cunningham Inc,1989,2306,9,16,6,15,35,55
f758318e-0e58-418d-a78d-c6e9a12b7fad,Policy young interview,Jordan-Obrien,1979,12386,7,99,11,12,65,75
819c97a3-29b7-4ac9-b36d-d6873a9d8777,Play social or instead,Palmer and Sons,2015,13625,10,21,9,12,130,180
a422363b-586f-4297-b350-c92e53c08d80,Loss each protect,Burke Group,1990,11442,16,20,13,14,130,160
69b6e960-d387-4b02-963e-47e4f15aadf6,Drive owner wrong particular,"Romero, Long and Conrad",2012,3250,0,15,10,15,100,170
d4e59d1e-fc32-42b2-bd72-5e1c14eac553,Exist commercial what,Soto-Kelley,1986,242,0,9,13,13,30,110
db9acc85-a9eb-4f22-b3d4-f965e7971acd,Seem find box certain,"Wilson, Cunningham and Prince",1970,14718,7,17,1,9,100,170
a817fbf3-f927-44fc-a540-1baa7a7a3072,Data wide standard remember,Dominguez-Walker,2005,8746,1,13,2,6,40,130
b7dfb267-5c6c-4e80-ad91-e639e80ecb40,Those to fear article,Smith-Martinez,2020,6397,11,11,6,6,10,215
d22dd87e-ee05-41a9-a259-9e1cbe02613d,Fear treatment hand street,Dominguez-Lopez,2001,5861,14,19,10,11,60,165
191dfa5e-db18-4efd-9581-c1a3cd9d8cd7,Measure speech lot,"Vargas, Johnson and Miller",1978,7882,15,16,4,13,115,170
68320519-4a71-422f-a179-32c9cc197710,Possible cover senior recent,"Love, Gomez and Peterson",1976,14413,4,99,4,11,25,40
86c32594-3743-4bdc-a6a6-ced94b3ebe14,Down next road game,"Patel, Gutierrez and Nelson",1973,14056,16,99,11,14,50,130
fce3c876-3db9-4a71-9030-9a762d86166c,Wide purpose home level,Anderson-Sanchez,2018,7391,21,99,14,15,135,195
c5f5cd96-c402-4219-901d-51db4ab5e574,Congress necessary piece,"Hayden, Singh and Rodriguez",1995,4721,7,99,10,14,100,150
91635ce7-af90-480f-bbb6-af59cd621ef8,Brother full hit glass list,Brown-Phillips,2003,3523,18,99,3,9,75,175
04d797ce-5c7e-462d-bac7-46baec6f13a0,Pretty year bring next,Bradley LLC,2002,9746,8,12,8,12,175,225
f2d5f7f9-d964-4a5c-8d44-6ed5d133da33,Buy she smile,Kelly-Mcdonald,2017,2126,7,20,1,11,55,210
15cb4c54-f9c1-42c3-8365-d22ae8d6ddac,Break film event moment area,Yang-Stewart,1973,3759,12,99,6,6,10,230
86082497-1e11-4686-95bc-c6b3334380b7,Live impact enough detail,Patrick Group,1996,5610,5,99,10,14,80,200
cfe3f371-2c86-4762-bab2-b68b1fb8eb00,Admit unit once pretty,Park Ltd,1982,2550,1,4,1,11,45,50
dd03d935-5610-4383-9a62-a4fac6d2febe,War activity yeah society,Kelly-Hanson,1992,8948,5,17,3,6,85,195
8899e06d-fa32-4bba-93ff-2694898ee5c9,Apply house rich become,"Donaldson, Peters and Washington",1973,6896,12,21,12,15,145,150
72e587b7-c3b5-4cc5-8d58-8eb476ea0ffd,Democratic miss artist catch,Perez-Summers,2014,12372,21,99,11,13,95,130
dfc2ab10-3c54-48e0-adf6-9c5031932b2f,Measure about apply space,"Johnson, Hooper and Ortiz",1991,8945,3,99,1,10,85,185
4391f74a-9276-4523-b695-fdc793d146ad,A property PM line floor,Clark Ltd,1987,789,11,99,3,4,40,80
e50ad041-cfc7-41d4-bf57-1886fd738359,So year half,Brown-Garrison,2018,3948,16,16,11,14,50,205
32fbc545-b250-4b7b-b3a9-d9dcc3026124,People training quickly,Brown-Lang,2004,2590,19,99,3,6,150,205
ca4bef1c-5945-48bd-86c2-a553463de091,Decade heavy plan peace,Calderon-Fowler,2016,12384,21,21,11,13,100,215
c94e993d-236c-4c7f-b0d6-94db832702bb,Top mention American if,"Harvey, Summers and Bean",2013,11652,0,1,2,15,60,75
65160f97-78ee-4f97-ac4f-b31382cb8d4f,Source pass put baby,Allen PLC,1978,5843,9,12,4,10,100,170
d072f4a0-551f-4a1f-bf7d-ee0a1d6ff8e0,Company central enter hit,"Myers, Pugh and Walton",1992,6957,6,17,10,13,135,140
ccfa258d-889d-45aa-afea-3ddc50480509,Support new rest,Mora LLC,2016,2162,3,99,3,11,55,90
e6d1084b-3ee1-4cf7-a6ef-2d1f58809402,Could occur alone image,Harris-Fernandez,1994,10851,4,7,13,14,90,235
d9606481-ccfc-4ae7-9a12-fbf0e347ad74,Coach decision again work,Patterson PLC,2004,450,9,12,6,13,40,235
c4772c93-e3e3-4b28-b0d7-ab230029114f,Dinner local training movie,Lambert LLC,1981,8810,7,10,11,15,155,230
6aab5062-e777-401e-b4a5-8d101816afa4,Involve true sort newspaper,Barnes Ltd,1997,192,14,18,10,14,70,225
b8e687cf-fe0f-4373-aa5e-2ee607b60ded,Above his two door,Duncan-Jones,1979,8787,10,19,5,8,5,175
c18fdc0a-4ec5-4c66-903b-0ae96b7e22ed,Side should with where,Sanchez-Cooke,2012,3857,3,21,1,11,50,225
6ce69aaa-ebb7-4072-8be9-ffaaa7d450f4,Charge plan drug data,James-Jones,1974,11570,15,21,13,14,50,165
6d0c9dda-2707-45c0-b1b6-87e7f6f12934,Civil name fear simple,Carlson Ltd,1998,7244,10,10,2,15,15,70
368c12d1-d9b0-4aae-b2ea-dc4c814ea222,Coach eight base mention,Lopez PLC,2021,14202,6,13,6,9,25,50
cc350465-b743-4901-b722-ef98cf2e6d29,Type same save voice,"Bates, Valenzuela and Farrell",1982,14333,6,99,7,12,90,180
c50ed881-758c-4613-b358-3bf0923b6c50,Early big box better very,Harris-Vazquez,1981,13076,7,19,6,8,65,160
16063366-da55-41c8-975b-7fa3c71c87e7,Fast money news seven move,"Anderson, Marshall and Wade",2006,7384,0,18,2,11,180,225
058a8758-a91b-4970-a454-13e9e0f47bc1,Source eye study four much,"Downs, Jones and Swanson",1986,5269,1,2,1,13,120,155
9a94ae01-faea-46d6-960d-2a026f3f0977,Remember success art write,Davis-Dennis,1980,936,5,16,7,9,65,160
8a9a3bd8-6f4d-497a-b16c-8c29f209a33a,Report strategy mean,"Garcia, Wells and Acevedo",2011,13130,5,12,1,15,70,105
1e9bb0de-687f-4944-a80b-ea71c2dd4772,No character run little,Barr-Ramirez,1993,1253,8,99,13,15,130,145
f869edb6-5cd0-49b1-8b46-618742f87bd7,Church race rather company,Farley-Hickman,2019,12974,3,11,4,5,150,225
f6d5b9eb-d2fd-462e-a80f-5d125423df2c,Possible of challenge policy,Goodman-Meza,1992,9225,2,19,1,15,115,205
4e1c6f3e-94b4-4574-adab-c88c40d179c0,Community memory nice,Brown-Perez,1973,8947,7,9,2,6,105,120
6ec4ddbb-9537-4703-a5dc-02d47f051be2,Kitchen where thank factor,Fox Ltd,1976,1586,12,15,3,15,210,215
af07a3db-67fa-4107-b766-29d4c1a24be5,Type note ready,"Flores, Landry and Watson",1971,9836,6,16,5,9,30,225
f01c841c-9462-4d5c-a5f0-e7ac58065f13,Here language pretty age,Bradley and Sons,2014,7533,5,8,5,9,10,170
e0f2d153-367d-4183-9314-08fae6fa1fd1,Nor west key loss,Rojas PLC,2009,12826,13,15,5,7,80,200
138f4647-736f-4e66-9bb4-c64f1ef9a61e,Study it skin nice point,Villanueva Inc,1973,11445,17,17,3,7,60,140
bd600b17-a7d4-4bd6-96f5-e3d829b5f75b,Bring well economy heavy,Mercado-Johnson,2000,1360,1,9,2,11,110,190
0848bc65-0232-4502-a5b6-2fce6c06b692,Value skin miss economic,May Group,1982,7014,3,13,1,13,175,220
fb8fb1f2-12c5-4c60-8128-28a834fa40f3,Partner though role,"Watkins, Huang and Kelly",1986,13645,18,99,1,10,20,40
308ab293-8dec-4406-b61a-34b474775942,Remain pressure join,"Hardy, Hale and Hall",1978,8745,15,16,9,13,55,125
5678ad3a-7b4f-4a09-9e34-cfed1bd48bef,Agency second beyond,James and Sons,1993,4780,5,16,8,8,155,160
6606d15e-6a10-410c-a2b9-efec14ae9477,Save cost nor,Harris Ltd,2019,5345,5,99,7,14,120,205
5c3182e6-0a33-407a-98f7-a18300e1c69e,Mind address peace manager,Fernandez Group,2009,12671,8,18,3,4,15,110
659d539b-cdc9-49c6-8c03-dea479b543de,Finish fill wish company,David-Pope,2011,1994,0,11,9,9,50,200
8eefd35d-69eb-4e00-91ad-4a085fbd73f8,Very itself around,Watson Ltd,1997,1381,9,99,6,6,55,75
35e50696-050e-44ad-88ac-8131aead6e06,Top beautiful moment police,Hubbard PLC,1971,10744,0,11,2,10,75,220
43d94b58-1134-41c5-adba-c1a8949be964,Voice trip short Mr six far,Garza Group,2009,8574,0,8,7,10,125,185
16576c50-25e1-4a0f-ab18-494f71579f59,Prove try attack manager buy,"Escobar, Little and Sellers",1992,12627,9,99,5,12,20,215
