5dd85600-42b8-4770-adc3-ff7b353bd525,Go song something,"Wong, Greer and Mcdonald",1976,5952,14,17,3,13,115,130
e906b8e6-23df-4f4b-b61d-279118ee57db,Your hair control too thus,Flores Group,2005,8172,9,99,1,5,125,175
72db5402-3d20-4fa6-a614-41314b8b8d90,Nature hand case look,Martinez-Thompson,1972,12818,5,99,7,7,80,195
140a7dd5-fef0-4b0b-ae05-f2e79fcb31b3,Professional one story very,"Simmons, Anthony and Mosley",1989,6091,1,7,4,9,45,170
6e45a9ad-5ed7-49fc-9693-980231f507b2,Throw close wide young,Brown-Taylor,1984,4969,20,99,7,11,120,230
cb5c79d2-d9d6-4572-92b8-81cda4a623b4,Design fall my gun,"Parsons, Jones and Smith",2007,2426,4,16,1,4,35,85
74057145-41bb-4b75-8f98-c3a75192c7b4,Law maybe might sit,"Mcbride, Weaver and Hood",2001,14832,2,12,4,15,65,165
f305273a-ef4a-4f6b-9412-4dffda07e698,Lot environment treat record,Wright LLC,1993,5610,4,8,6,8,50,100
30cf59cc-f75f-472e-a315-d426530e52bb,Serious method ask note,"Mason, Baxter and Adams",1977,5880,3,18,8,9,5,195
888349cf-ee67-4231-acb4-733e7ed53c89,Stage rate feel subject,Lewis LLC,1996,9511,6,8,6,11,140,215
995e4ff4-9fd3-42c1-884c-d366c9bc3e1f,Serve miss expert central,Harper-Bowman,2009,5984,11,99,1,2,20,115
27a8f47b-a1c7-49f3-b455-b5ea336ad79e,Just peace religious car,"Herrera, Harris and Nichols",2001,14141,9,99,3,7,170,190
e20818e5-6a15-4055-bce8-426cecc25395,Ever always know,"Ramirez, Hahn and Anderson",2002,439,2,99,1,3,50,150
c6cd6337-f456-4cfc-9771-a5bdd5247be3,Worry trial most after,"Johnson, Jones and Butler",2007,9633,16,99,1,10,15,85
b81eec9c-a23e-4cad-a1a9-328bb6476c9e,After chair near investment,Lopez and Sons,1971,7711,13,19,3,13,55,155
c3fa9421-37ef-403d-a754-e62ffa0a8802,Reach apply people admit,Reed-Lamb,1990,12535,2,7,5,6,95,110
34ecec26-6f74-49cd-a4b9-4b38adaf85a4,Mention though five food,Wong-Reynolds,1985,4949,18,99,3,14,115,185
50aa3437-4832-49c3-8193-526b15602541,Sign again back difference,Hartman and Sons,1980,4757,0,20,3,9,70,215
a4a4bd40-7f79-4327-af5b-a33774d776ab,Deal him either mean,Bennett Group,2001,5161,7,16,1,5,155,175
00913bfb-8707-449a-b8fa-0e069c9c60e6,Share peace Mr,Erickson LLC,1978,8110,17,99,1,2,5,235
3dfe33e1-658a-47b8-9016-6497c76ca5d8,Lead tax year business apply,"Pierce, Boone and Kelly",1972,12964,9,99,10,14,140,225
f46a95c6-560d-4835-8831-d55d089970ac,White article case second,"Knight, Hall and Johnson",1987,8305,10,99,4,10,45,205
8168c177-5224-44c5-bcaf-71b646928eaf,Talk somebody nice quickly,Morrow Ltd,1999,3808,4,10,11,13,155,220
781b42ac-3054-4d50-92a1-b322d93452e2,Break skill up wife mention,"Miranda, Morris and Smith",1971,544,11,99,12,12,15,140
5d7e92c4-822a-4cbb-be33-880d4114d8e6,Walk reveal black begin more,Miller-Williams,1983,7557,15,20,6,7,85,195
a01bfcd1-a2b2-44db-bbfa-dc44b44d0f91,Word itself down line deal,Sweeney-Jordan,1990,2442,0,99,11,12,90,100
70162030-0795-4b40-ab41-328441147f3b,Team task seem,Green-Rivera,2007,11042,2,99,1,13,140,210
61aca15a-0f3d-40db-8635-2e0677bed4a1,Concern hear small upon,Maxwell-Frederick,2010,5507,3,13,9,13,135,140
a42fcef1-b633-4b2e-bda0-07b8efcc3db0,Onto but bad,"Rodriguez, Thomas and Cabrera",1981,2238,7,16,9,10,60,165
9f4038b0-3381-4c5b-aa3e-e61a0ada7aa6,Instead behavior sound,Garcia-Morris,1988,11572,20,99,1,5,65,95
06ff3986-3b4e-4608-9973-bb2b0039349c,Mission local program put,Jennings-Hughes,1992,14019,18,99,9,12,155,230
23deed34-567f-4dd2-acc8-c5e565aa2ee8,Modern each market beyond,Simmons Group,1994,14233,8,13,3,3,60,190
97ea7cf7-410d-4797-bb3e-b25dd4f1e7ba,Month trip health fear,"Johnson, Lamb and Freeman",2003,5756,6,99,1,15,55,150
42aec238-aea1-47ee-966e-1168466a384f,Step appear where cold eight,Henderson-Carter,1982,2843,2,6,7,14,10,30
f48da81f-aa4e-4f8d-a55e-a3db372ea2b4,Agreement ok husband their,"Ramirez, Perez and Mccarty",1978,2055,0,11,14,15,65,235
43736821-f61a-4bf5-a4a1-9b2f836144db,Lead stage bad short,Reynolds PLC,1989,4305,0,20,2,8,80,175
5616b2d1-0a32-411b-a06e-9596d1ee94b2,Tell serve should tend,Williams Group,2005,11399,4,99,7,11,55,145
b67b2db1-83e7-4875-82ca-b89e52ac80de,Apply whether fast enough,"Wall, Smith and Kennedy",1994,1166,14,21,3,7,70,120
6694afaf-6163-4396-93c3-0d751529d81e,Thousand low data,Decker PLC,2016,10445,18,21,1,4,30,125
b3f36478-43e6-4906-9ec5-794e079dea32,Determine pay occur event,Jackson Ltd,1981,6597,8,19,4,14,35,230
cc2bafe7-2d44-437b-ae76-647ed9f8c3f8,Green lay week live,Robinson-Abbott,2017,35,9,99,1,15,60,115
03b808f5-448e-4c1e-9485-caee78db1e35,It not baby choose,"Fields, Ramirez and Baldwin",2015,1875,11,17,1,9,95,125
678a16ae-cfe7-4ba1-a106-299e83b713ee,Maintain arm national meet,"Colon, Cook and Fernandez",1992,11422,5,15,9,12,20,80
2798f22d-6e88-43ed-a5c1-643ef070d0f2,Occur remember smile word,"Butler, Livingston and Kelly",1978,14736,18,99,8,10,5,150
b39df669-ce8c-4ad3-8c61-cfcc1e6960b2,Oil enough whatever bad,"Barnett, Davidson and Williams",1980,5982,7,99,9,10,65,115
9e7ddb2b-51aa-482b-848a-bca6a42a4b5d,In fill up attorney,Gomez-Miller,2015,14205,0,1,7,10,35,150
def481b9-266b-4fa2-896e-4f51f2f9258b,Nice serve green he,"Smith, Morris and Lester",2002,2551,0,99,4,10,55,65
64e2ba46-9ba1-4d7f-8a71-724ea54c0c73,Guy general strategy me,Luna Ltd,2009,2191,3,9,10,12,125,150
6034f49b-edd3-449b-96f0-3456ae3a0328,Suddenly care against,Johnson PLC,2004,9829,14,17,1,13,80,165
a4d9367c-705c-4536-9295-ec6482a680ab,Grow war training hard,"Spencer, Patel and Ward",1970,181,7,7,2,5,30,205
239aac2d-0317-4057-9cb6-8ad4d3555136,Majority media best where,"Stark, Wells and Clark",2007,9399,4,99,9,13,145,155
3c14734d-e902-446c-af7a-ac8586db078a,Growth room policy to,Jordan-Daniel,2001,13421,4,15,3,7,10,195
14051433-4352-42a0-8bbd-9ae5accf68a7,Win recognize force,"Ellis, Fisher and Jordan",2008,12412,17,18,1,15,5,55
d99e6edb-aa35-4316-974f-c12f9b33a6d4,Career most mention film,Dawson-Esparza,2015,5298,3,20,4,12,5,170
d60ec0ea-6d57-41e8-860e-e4b789eb7737,Put it accept finally Mrs,Owens-Hansen,1977,6264,5,16,5,12,50,85
ac6884cf-556f-4b93-a78b-66eebc23bdb5,None his street her,Moore-Martinez,2001,6977,4,9,2,7,105,235
a25b8aa1-e16c-42b8-b4c5-a297d6cec795,International goal letter,"Underwood, Mcclure and Ashley",2012,12062,2,17,11,13,40,70
6a3cda95-1d49-43ee-9686-b4e8602d5c4f,Oil recognize wait you road,Ellis-Orr,1988,9159,16,17,13,15,105,150
e350ff09-0bbe-4f76-aa20-dbdcc337ad7c,Away night move court more,"Suarez, Delgado and Larson",1970,9953,13,17,2,5,40,190
e15d2a07-d703-41c4-af2a-85c82f10f6cc,Whatever everything per tree,Price-Merritt,1985,14051,13,18,4,5,65,165
359679d1-b160-4b89-866e-c2e1ace78673,Spring business little yeah,"Adams, Fox and Smith",2015,1846,1,13,1,13,100,210
dd4b875b-25b9-4664-ade1-67b9cff8dd9f,Majority staff fill media,Hamilton-Roberts,1992,6904,1,14,4,7,115,230
9742d9f3-48ed-4c17-9107-1a3fc36c2771,Character across west then,Fletcher Group,2011,10678,3,18,7,13,20,30
033e60fb-53d0-42a0-84fc-b01a26e7c507,Thus bag employee,"Martinez, Collins and Graves",2015,5857,9,12,1,4,160,170
659bc6de-6448-48fd-b03e-35bbb5cc5547,Light generation arm hard,Pierce Inc,1977,7262,2,13,4,9,35,80
db64bc6b-c070-49df-aa92-2d5b141b88c1,Front rise answer act ten,Berg Ltd,2003,12738,1,6,10,13,80,155
f770fd6a-eda9-4503-b7a4-7729a9d83e8d,East arrive center two,Dodson Group,1977,11915,19,20,1,1,110,140
50442e0c-802e-41a2-9bea-5fdc1d45e937,Week suddenly great drop,Rivera-Alexander,1996,3372,0,0,8,14,30,215
c92bf6a7-0380-4722-8219-11601f2b902b,Forget fill former she,Brooks and Sons,1973,4440,5,99,9,10,170,190
9ddafd75-c0ea-4abb-bd62-ee9caef1f064,Program Congress newspaper,"Hoover, Mitchell and Gonzalez",1988,9002,7,12,2,14,20,120
72f537a8-ce4a-483f-b263-dc2b080a6000,Environment only him big,"Frost, Hunt and Tyler",2009,10861,7,10,8,15,55,210
d1d567f9-bbf0-47ef-8e39-de56dd268a99,Staff him push last section,Hanna-Benson,1978,1391,2,9,7,13,25,140
1f32c1da-bd63-4c37-875d-36210ea47e7c,Test sport have particularly,Garza-Allen,1999,12880,12,99,1,11,105,180
2198af14-57cd-4dc3-90ae-845028e468d9,Exactly fund individual card,Norton PLC,1988,14287,11,18,5,8,30,230
6478e05e-0400-46a7-a024-fc2b989e66ac,For I win. Play six risk,Ramirez and Sons,2020,13994,5,13,9,9,55,110
fbf7a867-65da-4ec5-b8ce-7eb6c0f0e721,That try TV onto should,Wallace LLC,2000,2534,10,14,4,9,30,70
46bbaab6-1b28-4393-b412-6dc5143c6674,Set couple by six big,Dixon LLC,2004,8880,1,17,6,11,65,185
3f2e4348-786a-4c09-856e-ec0fbb123aca,Better ever area role fact,"Avila, Lee and Durham",2000,5781,1,21,5,11,115,130
efacb49c-1192-4fa9-93ec-d21687980210,Table safe attorney kid,Little-Hart,2019,2636,5,18,5,7,60,185
f0af6207-5b86-4611-9fe5-a61cd9f899e9,Future find difficult,"Kirby, Alexander and Turner",2021,1169,8,14,2,4,135,175
a674d794-7221-471e-9507-9714cbd15b23,Wait woman century audience,Mcbride Group,2020,5885,0,17,7,7,180,195
81a19c01-ac25-425f-b5bc-8a9df6346c9d,Skin play economic must,"Crosby, Alvarado and Schultz",1973,9665,13,15,4,13,5,225
f1e7f9b5-075a-4479-8b6d-6ac1ba73511b,Issue music follow power,Mitchell-Wheeler,2006,7791,21,99,7,14,60,125
bdcce082-9e31-4cb6-aa74-19230e8fc25c,Turn should painting chance,Wilson-Houston,1998,1529,6,99,1,10,105,170
9e03ea99-299e-4ac9-b1ef-249d88e216ef,Available visit office these,"Gonzales, Hall and Lucas",2009,6437,6,11,2,2,20,95
8aa1a424-49b1-48c9-bc68-3a2323048715,Would action player,"Chandler, Ortiz and Rasmussen",2016,10668,13,16,5,10,40,120
faf2f332-760d-4a1c-8a12-e3deeab8e6e5,Low star whom into major,Garcia Group,1990,11931,16,99,4,5,25,190
37edb1a4-911f-45cd-a342-7d2698d0d0f8,Card scientist people real,Conway Ltd,2010,8794,18,99,5,13,70,235
7f99aab5-7487-40bf-8145-3ab0574cd37a,Thank into have property if,Richards PLC,1979,13916,6,17,3,4,35,135
438fc0ad-f831-45ff-9940-684a4078c99d,Describe not return more,Bryant-Villegas,1980,12423,4,11,7,12,30,190
3dc75be4-31cb-48c7-a4de-c8f27c62a0ac,Bit anyone major officer,"Booth, Marshall and Green",1983,3696,6,7,1,8,105,140
19da7ca0-9fa8-41fa-8e61-4ec50f54678c,Agree tonight say property,"Maxwell, Nelson and Cooper",2003,1346,12,99,4,4,115,230
89317efe-b14f-4d09-abf7-ae3011f04fc3,Town common mean,Davis Inc,1995,7581,10,99,13,15,45,90
ff5ef79d-c485-4674-be12-c7f65b7c186e,Want sing red,"Hardy, Schwartz and Stewart",1996,3226,0,15,2,13,5,205
5e3fb435-0522-4613-8a1f-66691efadd01,Bring become on south,Chen Ltd,1980,5397,0,99,2,10,115,155
5f455b14-f728-4a86-9a18-60f6631d0de5,Reflect my how debate,Patton-Medina,2000,11032,6,9,2,8,15,110
a4f4ad5a-3b3f-46b7-b1b1-dc14a4df6420,Account push business,Anderson LLC,1977,4984,2,99,4,11,60,130
0865c870-b9d2-4468-9b4f-409560cbdb4c,Your son reality school,Martin Inc,2021,3417,12,18,3,6,65,115
4e0edf94-7cb4-4748-b90c-70bb0ea4c253,Leg business number know,Smith-Shelton,2021,5004,4,4,13,14,130,140
eca65e3f-41e5-4181-adf0-a82bde09f7f1,Look exactly food again,Gonzalez-Barker,1994,5004,10,18,4,9,60,230
a4f227a5-af3e-4fbb-9c4e-877c2928f379,Tend ever direction,Williams-Hodges,2020,5944,16,99,4,8,25,165
bdc40c70-e52a-43f5-b90c-c5334b9c334a,Stage daughter federal drive,Larsen PLC,1998,11859,1,6,4,13,50,165
7673815a-dbc8-4d03-8087-3e37a9e16742,Often style social section,Howard-Hampton,1977,4841,7,14,4,13,45,205
45ba185c-cbac-4e28-9c8c-152adafe1b03,Sign son significant,Allen Inc,1986,5384,8,17,5,14,10,210
b1f0a923-3300-47a7-8887-289f7e4a662e,Make less just guy,Perry Group,1989,11327,9,19,2,5,20,100
cbbb6c0a-568a-4357-acc1-919801e47192,Network east edge firm,Coleman-Flynn,1992,4537,1,21,5,14,20,85
ac576e12-9c40-42ff-bbcc-efa5f8e268d1,Occur car speak else,Miller LLC,2014,11795,16,99,5,15,185,190
ffc6cd0b-6d42-49f4-8e62-a5d448cf8b5f,Ask ask work peace side,Weeks-Edwards,2021,12568,20,99,5,13,125,205
a3af3b03-25db-4e01-9301-ad286d5d0a4e,Response when its travel run,Stokes Inc,1973,4333,0,99,6,15,60,210
5729d338-b768-40c1-9e30-2297bbb8cf49,Person today onto base,Lee and Sons,1982,4346,8,10,11,12,10,215
d85d67f6-b9d9-4132-8e8b-fb3b44491654,Throw government cultural,"Patel, Smith and Arellano",2017,13761,6,17,2,5,40,215
8a8bf52b-cfad-4c1e-8506-8b4f86992441,House letter gas,"Brown, Gates and Wood",2020,6595,1,20,9,13,45,140
9a79942f-63b1-4194-9fda-840a323f43f5,Grow hard marriage benefit,Riley Group,1985,13972,16,99,5,14,40,180
1fe48268-6f10-459b-9a21-2d72d1d79109,Middle avoid will as church,"Hunter, Barnett and Acosta",1974,6929,8,99,2,6,95,145
51d86b79-92c5-426b-bd3b-cf9a5b0e8fb7,Fly southern inside,Kennedy-Daniels,1991,1221,2,4,2,12,65,90
e931b3cd-8fc0-448c-9b52-adaec7fc6303,Control force sister able,"Paul, Richards and Weaver",1993,11575,9,21,1,3,15,65
eff8d3f2-aae7-40a2-b56f-ea542af83b08,Poor charge live baby often,Evans LLC,2007,4427,6,21,11,14,115,220
6ef64544-d0dc-45b3-8a02-8a6f24b1dfdf,Dark see recent,Sullivan and Sons,1981,10731,7,10,6,14,10,35
a4d76f88-fb9d-4529-9585-ca146e138deb,He see report herself,Villarreal-Harris,1982,14745,5,16,6,14,20,70
66153225-b4f3-4f2c-8954-c3c54d4330e0,Spring care network stage,"Mcdaniel, Flores and Gates",2018,2618,5,10,6,10,20,160
33a0e0a0-ebc0-424d-b6c1-3f5542895b5c,The season keep bill,"Allen, Bryan and Wilson",1985,4239,20,20,10,13,25,160
8a19331b-c1a4-4586-b141-dee2fc4ee979,Group floor rich wind,Cain Group,1970,8714,14,18,7,14,45,140
fc565507-342c-4f1b-bd5f-2648888b7f1d,Him break clear offer,Wood Group,2021,3621,8,99,2,13,40,210
c9a0afcb-eae3-4ce9-a48f-817f817f521b,New thus guy bad,Alvarez Ltd,2019,13135,3,4,8,11,80,215
0a79c7ec-3d8d-4ace-9855-1075e45da424,Room whose build set total,"Wallace, Brooks and Smith",1981,9757,5,13,3,10,65,230
3ce12504-032e-419e-929b-9dcb31783a21,Everybody top paper join,Carr PLC,1990,4965,3,13,7,15,35,190
4f8cf91d-712c-482e-809d-f99959a22bf1,Tell one window necessary,"Collins, Paul and Ford",1971,2435,1,5,7,13,135,175
3fe32597-942b-45dd-bb06-5b39c23d3104,Large hair others like,Williams Inc,1999,14800,19,99,2,5,60,200
b28538fb-f62c-4ce4-970e-eec7ed81bbb1,Most agreement arm politics,"Tucker, Rivera and Ball",2012,13033,5,12,5,9,55,190
57e55992-5e76-426b-a5f0-07959ba54e01,Degree focus week law star,Lawson Inc,2008,11311,19,20,1,12,55,155
8e8e021c-640c-4fea-9371-195138833294,Give spring kid,Contreras LLC,1999,3734,0,99,3,9,25,175
eb01bbb1-6d19-4003-af72-1a40834153d5,Doctor stuff deep help,Hamilton Inc,2018,5041,1,3,5,6,135,195
ff3ab1ef-4978-4c62-80b5-5e49fa178238,He face part turn Mr,Fleming-Lopez,2001,14308,10,20,5,12,5,35
a3c14568-440e-4c34-acb3-abd7610d0a64,You try young threat while,Newton PLC,2000,2061,16,16,11,15,80,90
c532d947-c3c5-49b0-9da5-d5d90df3e4d7,Win threat stage,"Ramsey, Ramirez and Lopez",1973,12836,5,15,12,14,160,205
616ccb9f-2522-4a3e-9c0d-df38c425bf9a,Best store all whether talk,"Porter, Long and Fowler",1993,14204,5,14,6,13,150,175
36f8172b-8ab0-48e2-9bdd-b144f09bbe65,Create shake paper miss goal,"Riley, Vargas and Frazier",1978,10475,0,9,1,9,50,95
384c1901-9138-43ea-84b0-b9761e22876c,Past increase base wide,"White, Medina and Powell",2011,8294,15,16,5,13,170,180
66439a7d-e590-418f-8922-65fad307db76,Perform section president,Moore Ltd,1978,5135,6,21,5,11,80,230
0af032bd-4829-48b3-a252-7aa32cb8eaa9,Grow physical send director,Brown-Valencia,1993,5715,13,18,12,15,15,80
eef8b890-a4b3-4e50-882d-54af0a2c6538,Three their side four,Pitts Group,1974,3215,1,9,3,6,170,210
b3d29445-e2f3-4403-86a8-c7e5b2b445e6,Energy camera radio same,Glover Ltd,1989,10509,8,15,8,10,40,235
1e8b6933-1db5-42e9-bc82-d72ed5b66a4a,Close discuss executive,"Rodgers, Bates and Cooper",2008,2698,0,21,10,12,30,195
4a265833-2bde-45f6-85ba-f21848496bde,Step arrive test TV,Wilson-Ryan,1976,6771,0,1,3,8,55,75
79945da2-756a-4eaa-ab26-51f16b083939,Institution citizen idea two,Lee-Howell,1986,9182,3,99,3,14,20,105
452bdd33-a4b1-4fa8-b891-51ba135548da,Medical card follow,Olson LLC,1981,913,4,19,8,12,75,145
e23fe5b6-3c2c-4c94-901a-33594d8e4cb3,Practice health provide,"Johnson, Page and Nguyen",1981,4588,16,17,4,15,115,190
5bd7e7dc-59d3-4d48-9777-640d1b259151,Box market strategy indeed,"Rose, Meyers and Benitez",2005,5460,15,99,10,11,25,180
8be8415f-a980-44b7-a97f-abd8cfdd0475,Trip arm personal,"Smith, Roberts and King",1988,11539,11,21,11,13,15,100
eba72f6a-d344-45c0-b7ba-a17cfcfe0f34,Seat family staff could,Gardner-Lopez,2015,1884,10,12,4,11,35,160
324eac84-faac-4a61-89c9-f84009abac2a,Speech top medical form,Alexander-Beck,2016,11387,0,4,2,12,5,90
93832a3b-db0f-4796-baf8-b080424d15d7,Expert hard approach civil,"Mosley, Flores and Gonzalez",1994,14544,1,3,5,9,160,215
8b5792d9-61d5-4abe-bf07-c49281feda97,Back now last pick,Hall-Villa,1970,1943,17,99,5,13,190,215
556f98d7-10b7-4ad3-b05f-4f1f0efb7481,Station nature bank table,"Ruiz, Lutz and Bennett",1984,1353,5,9,11,12,20,95
400d8170-8a74-4d39-a1d6-225f9b522c4d,Me crime focus,Barnes Ltd,1980,7206,7,19,5,11,140,225
bfd8953c-1bfe-4ee8-820f-83feae20b434,Federal issue party him,Barnett Ltd,1983,6309,5,16,1,8,165,230
2d77995f-8b16-469f-9063-f0140d0be66c,Someone medical method bill,Henry Group,2018,14695,18,19,7,11,15,70
efe877d6-624e-4e07-ab16-7ee3c7a4f149,Live natural read all simply,"Thomas, Garza and White",2007,6305,1,8,7,12,50,100
711269ff-6966-412b-8ad0-e205fffbe9c3,Arrive land realize,Alvarez-Rowe,1985,8975,17,21,9,13,50,115
c69abeb4-f1ba-4f64-9cce-678865573b8f,Pick prepare school travel,"Hernandez, Levine and White",1997,2,5,21,3,9,115,200
178aa237-a6e7-45c3-ace0-33bbf2e9c60a,Stand road thought might,Gates PLC,1988,10860,0,17,1,9,85,140
e5b2afc3-0a5f-4967-bdf8-212337de9857,Night speak friend,"Hurst, Morgan and Warren",2010,14476,1,7,10,12,80,230
7000c926-24e4-44aa-8298-739ca30e349f,Spend dog others kid,"Garrett, Lane and West",2010,10005,0,5,3,5,165,190
244cd77e-d307-48e0-9672-5bb7dc07873e,Be near red central,Warner PLC,2014,14882,0,8,1,12,80,225
5da48bf7-a1c5-4f39-82c7-7605ebafb332,Wonder compare senior join,"Rogers, Ramirez and Gardner",2021,7698,0,99,2,2,35,195
eb2be24e-8e42-4c4a-873c-cb65a8b949a8,Ground number group,"Brown, White and Lopez",2000,4143,6,16,5,7,50,185
15918a14-e42c-426c-ba61-56b45e42c40c,Oil better sound baby,"Owens, Martinez and Howard",1979,13022,10,20,1,11,15,20
c3ec41b3-3489-42dd-b593-a259a5739886,Door data be rise,Harris-Walker,2015,9870,4,15,1,11,70,100
035723b4-ae40-4c8c-81a9-8bdf90ab303e,Spring structure music night,Bishop-Walton,1992,9861,6,99,5,15,80,110
abd4ad90-749b-4b51-8c4b-adfb93a1cc6c,Write world price,Cruz-Castro,1985,12600,12,16,8,13,25,210
f3650305-a258-459d-9b60-e9d8eef9bbcf,Indeed skill mean,Knight Ltd,1973,12416,5,7,1,10,50,115
e77641c4-4114-4e5f-971d-01b695446976,For meeting catch,Espinoza-Smith,2000,7426,7,10,7,8,110,160
f666865b-00bb-4435-bd02-8fc6c325f4a2,Example make cultural apply,Hall LLC,1980,12477,0,15,7,10,65,80
03bc6f68-64ac-4423-a70a-88483e10c951,By themselves TV me by,Estrada LLC,2007,12871,14,19,10,12,115,175
549e6723-20fa-45b4-82e8-52464c73b896,Tax read maintain,Bates PLC,2018,6641,9,99,2,2,65,110
51481712-4dc5-4136-8323-6e4b4d79279c,Way note safe still,Steele LLC,2019,10962,5,99,8,11,145,155
75738c86-cf59-49c9-9305-a2f505cfd566,Area maybe partner as,Zimmerman LLC,2011,8937,1,20,9,9,160,170
71e28bb9-955e-4b24-b42c-cd9b08406f76,Few catch region,Yang-Valencia,2011,4040,14,99,6,9,40,190
98cead82-4e2a-4154-a7d8-8b54013ca43b,Purpose question likely book,Miller-Ward,2018,11356,6,15,4,15,135,155
a89f51a8-c438-4ca0-8f00-b9cbeb3f5a6b,Capital direction common,Wolf-Thomas,2003,13179,2,99,3,8,140,175
d911f129-c7bf-4a20-b01e-69dba1babced,Market lead able little true,Richardson Group,1990,9112,3,13,7,15,55,175
28fd6687-f4c5-4f7b-9743-2202fbbab853,Bank owner discuss,Manning Ltd,2012,9381,21,99,2,4,110,215
be3596e6-26b7-4f3a-ba62-cd68b1a3aa60,School hospital whatever any,Mitchell and Sons,2020,2957,6,11,4,13,60,65
a49ab6ae-25d6-45c4-89b0-b2e12f1ed947,Nothing choice national call,"Torres, Martinez and Mccoy",1985,4058,8,17,11,12,5,70
c82b1456-8eb7-45e6-81d0-8ade019527dd,Everyone threat join herself,Morrison PLC,1977,7378,12,21,3,5,110,135
91ad85fc-9b6d-4881-9a51-571468922e91,Could mean some,Aguilar-Craig,1971,12271,7,99,1,14,5,95
ee23f1a8-5e8b-4342-abcc-7cf8405e6bfd,Character truth rule little,Mcbride and Sons,1975,4772,9,16,7,7,145,230
0dc61692-35ff-4ea8-b5e8-559406b23fab,War maybe back own threat,Brown and Sons,1991,13271,1,12,2,2,135,230
9c70e9dd-bbfb-4288-a26c-6d5b7c14adc1,Let fall person baby,"Spencer, Fields and Mcdaniel",2007,4316,15,16,2,10,35,145
8743788b-7cb1-4d10-9075-26f644bfc467,Provide entire visit,Mitchell-Cooper,1981,12694,17,99,1,10,80,235
7f72fe59-3a5f-4182-b341-eedf02bbff5e,Side democratic miss low,Rodgers-Lowe,2009,9812,4,13,6,9,40,200
602c8e6a-a4b3-4144-89e1-fe36415c7232,Pick final recently report,Drake Group,1993,6443,5,21,5,7,75,200
d611f89a-928d-4cc1-ae73-7ab83c2555b3,Skill really risk see,Horne-Cook,1974,13616,9,19,3,15,185,235
07feb372-1997-4c76-8422-71d9d9b66d2d,Push forget conference take,"Berry, Lopez and Ochoa",1982,11589,17,21,7,11,85,230
f2cd4052-a711-43d4-96bc-4a27e444b15b,Rule other region,"Bennett, Burton and Jones",1994,11223,7,17,7,8,160,215
0a456a66-dc67-4800-909b-6886072304d7,Ago past science seven,Walker Group,1981,10308,3,9,4,12,120,235
15b35c41-3c7f-4cea-84eb-30599a5e7b47,Natural somebody bit north,Phillips Ltd,2006,6411,4,11,9,13,65,95
8dca237f-287d-4aec-84c8-7ee28b5592e8,Mind analysis recent,Hernandez Group,2020,3898,4,99,7,9,115,170
7ba51700-d064-4b9c-b774-405df554c100,Foot three expect one,Rhodes-Meadows,1980,7811,0,15,1,4,160,180
084771de-04cb-4687-b9d9-ee09e3c6102a,Dog raise executive manage,"Graham, Foster and Smith",2000,9083,13,21,11,11,95,135
3cc0ef52-d6a9-4e23-8c14-cc4604978fc6,Company step happy bed,Hughes PLC,1994,11910,16,99,9,15,70,75
73c7d452-12a7-45f1-9a5c-1aed985e1e72,Company score say while,Williams LLC,2013,14361,8,99,6,7,90,115
377cb306-5c17-4e88-a082-807d8ae829e9,Book piece I many,Short-Hall,2013,6189,14,19,1,3,85,135
d1316857-0155-4624-9973-aed2b772fabd,Claim live hot,Cook Inc,1991,12235,5,9,3,8,10,85
2cf81e0e-4828-47bf-a819-c2bd28d3d2c9,Million chair carry art,"Clark, Johnson and Oneill",2015,8380,8,19,11,11,135,175
c33f4658-844d-4059-a871-6f946494ad90,Behind table head,"Ortega, White and Daniels",2010,2832,4,8,10,14,160,190
4cea56eb-28e0-46c6-bfc8-3fb39c88525b,Forward within build,"Boyd, Gonzalez and Gonzalez",2002,4455,17,19,3,14,180,200
8d5a14aa-3a96-46b7-a6b8-80130592ab15,During Mrs red throughout,Crawford LLC,1988,3800,13,15,2,15,120,160
a2c3924d-cad9-43b4-94ba-daf5d1468b68,Center goal firm,Turner-Patrick,2020,9886,3,14,14,15,55,210
243e8dab-1f76-4118-9d1f-8b2d3af507fd,Politics open affect improve,Ross-Owens,2018,6987,2,17,5,13,115,180
113f52e7-ec1c-43a0-aff5-01539b07d874,Western draw power morning,"Sexton, Schneider and Wagner",1992,10434,2,21,7,11,120,185
95a86bcd-75f0-4cab-b2d1-e60887241794,Where lose Democrat by,Schmidt-Taylor,1998,4050,21,99,9,10,165,215
60ff676d-e786-4cc9-8de9-2ddf4b6d9d4f,Response state ever day cost,Holden-Woods,1993,7919,10,21,4,8,35,140
0f9c4919-5f6e-4c4a-a1c6-9cb0365c5f98,Country explain above seek,"Randolph, Hernandez and Collins",2020,4973,21,21,4,11,20,95
fe260c89-dadb-4d2d-ba7c-6189c07d42f5,Think similar minute party,Garcia Group,2021,4423,0,5,9,14,25,205
749cfd92-4be9-4460-b717-4829e2aa32fd,Fast spend within,Peterson and Sons,1979,9323,7,17,13,14,135,200
0acfd88d-567c-49d0-b602-719cab3f3220,Key girl special over lead,"Payne, Robinson and Hoffman",2018,12526,3,17,6,6,25,150
52af9ede-1bfb-4f46-a62f-56d6b8cbe86f,Step indeed middle people,"Pineda, Reynolds and Strong",2011,1327,17,20,2,6,60,200
5ca6c6bb-1505-4cb9-b59a-7036bdeb7464,Land away discussion word,Hernandez PLC,2014,7000,4,13,2,7,170,210
2488426c-8ba3-40a6-b338-b1a6ac7e088f,Sign born health sign memory,English-Lee,1978,11056,5,6,1,8,60,200
8eb54c49-c73b-45f9-a244-221e291c1788,Respond easy break describe,"Martin, Williams and Mooney",2010,4391,6,99,5,11,120,155
77e6e904-8691-4d1a-9999-c6dde38c86e9,Sell book clearly few drive,Gonzalez Ltd,1983,7364,4,10,10,12,155,230
3ab81e5a-0c66-43a0-a210-d791b741977f,And stage dark treat,Zimmerman-Riggs,1972,13518,1,21,4,7,90,155
94e7b205-168a-4212-9796-9576a8a0840c,Product quality ok,Davis-Salazar,2002,1400,16,21,1,4,20,40
eee6c950-51e2-4418-b578-1490fcd4425f,Really remain red most,Hampton PLC,2007,6039,15,19,3,3,180,220
2eef247a-6efa-49d8-bcaa-ae25dea61cd7,Too create yeah,Fox-Riddle,2017,10388,7,99,2,12,30,75
cbdec943-3e03-402f-8e32-db7284781577,Size apply argue leader,Thomas LLC,1996,8088,16,18,2,5,25,70
01cb4628-17c1-4936-9015-9808a82c8857,Room physical body when fact,"Haas, Alvarez and Gates",2005,2886,5,7,4,5,55,145
9031a42c-7019-46b8-9720-3446650e2149,Enough sister old,Bruce-Johnson,1977,7503,0,10,9,11,45,230
a3299507-32db-4740-8d34-b3edaf31509f,Situation full nice produce,Meyer Inc,2014,738,12,14,6,10,10,150
62544631-e57f-476d-a22f-bf8c6bb6a26e,Place wall impact yes,"Miller, Wiggins and Walker",2003,8553,8,8,2,6,40,50
74d8fd3a-397f-4383-95b4-5046c43fe4d5,Chair air remain face also,"Benton, Miller and Holder",1977,4570,4,99,10,13,70,180
899f1592-ac6d-4ac5-99e6-6c9f3477d22d,Often hot wall those among,"Clay, Hayes and Smith",2004,2526,5,11,5,10,140,215
b2911b75-52c0-41bb-9c5e-d509f031cd79,Clearly material kind,Clark PLC,2020,1958,4,99,2,6,45,235
4b9cb62e-1959-467a-ab4b-52ad5e693dca,Call within loss,Wilkinson LLC,1983,10157,12,15,10,13,85,150
9e13d11d-8f57-4da3-9227-9e06157932ed,Decide gun choice,Swanson Ltd,2019,5491,10,15,5,8,55,230
458d3d55-b01f-4bdd-afbb-43fa0eeb93b1,Note weight claim teach,"Foster, Pope and Williams",1975,6872,17,99,11,12,10,210
34e5396b-0d39-459a-a1ab-09f1f6d3406c,Standard page similar finish,"Arnold, Wilson and Sanchez",2003,9248,3,14,12,15,55,105
c09ee653-fada-4d23-8d9f-2f44a4777a35,Rule somebody data vote,"Bartlett, King and Coleman",1982,2668,7,21,9,15,45,220
f5b961ba-3eef-4679-a43d-80218df9dac9,Present option past impact,Aguirre Group,1971,13846,0,13,1,4,195,230
94e15f35-abfe-4521-b776-edd7f4290065,Raise material important,"Simon, Rasmussen and Williams",2012,1124,12,99,9,10,105,125
ea9faa63-ee8b-4847-9b04-8af9dd51268f,Mouth road wind safe,"Ortega, David and Smith",2020,10549,19,20,10,12,115,165
